status_id,status_message,status_author,link_name,status_type,status_link,status_published,num_reactions,num_comments,num_shares,num_likes,num_loves,num_wows,num_hahas,num_sads,num_angrys
759985267390294_1568792649842881,"Hey friends - compiling a doc of resources for our hackathon and wanted to solicit your help. If you know of things (APIs, frameworks, tutorials) that are useful in the hackathon setting (because they are robust, easy to learn, etc), please drop it in the comments. If you happen to be at HackCWRU we'll give you a shoutout by name. 

hack.cwru.edu come thru",Yidi Huang,,status,,2017-04-12 00:17:39,7,3,0,7,0,0,0,0,0
759985267390294_1568626473192832,"Made this chrome extension today because I always have 10+ tabs open and wanted a way to save everything without bookmarking

https://chrome.google.com/webstore/detail/workspaces/eehocaoejekpmecmfecdkpohdkgkmoee",Md Malsi,,photo,https://www.facebook.com/photo.php?fbid=344033729331958&set=gm.1568626473192832&type=3,2017-04-11 20:51:55,81,18,0,69,10,2,0,0,0
759985267390294_1568241149898031,Bootstrap or WordPress for UI... Simple answers guys,Osita Chiemeke,,status,,2017-04-11 12:39:41,8,19,0,7,0,0,1,0,0
759985267390294_1568829126505900,"Has anyone ever downloaded their facebook data completely? Does anyone know how to read the files without completely crashing your browser? 

I have the htm file that has allllllll my messages ever on this account and I wanna read it, however I'd like to convert it to a pdf, all the htm to pdf converters I've found have had problems because the file is so big 104mb. 

does anyone have a solution here? I just wanna read them",Belle Salcedo,,status,,2017-04-12 01:09:47,5,14,0,5,0,0,0,0,0
759985267390294_1568453849876761,Anyone else have this kind of experience with Electron apps? I always have to force close Slack because it's kind of a resource hog,Irfan Khan,Electron is flash for the desktop,link,https://josephg.com/blog/electron-is-flash-for-the-desktop/,2017-04-11 17:06:46,18,12,0,15,0,0,1,1,1
759985267390294_1569359643119515,Hi HH! I know this may be a long shot but I wanted to invite anyone who will be a JP morgan TAP analyst to join group. Please share if you know anyone that is! https://www.facebook.com/groups/1415161311860372/,Lauren Mitchell,,status,,2017-04-12 11:37:32,1,0,0,1,0,0,0,0,0
759985267390294_1568532309868915,"This was one of the most fun blog posts I've read in a long time:

",Cassidy Williams,Typing the technical interview,link,https://aphyr.com/posts/342-typing-the-technical-interview,2017-04-11 19:07:03,52,2,5,38,9,2,3,0,0
759985267390294_1568817919840354,"I want to test out web development. I still know some HTML and CSS from high school, and I imagine that they have changed much since then. What would you all suggest I try and learn to create some websites with backend functionality for fun? I am currently looking at Web2py and Django as Python is a language I use the most.",Jose Eddard Crimson,,status,,2017-04-12 00:50:04,0,4,0,0,0,0,0,0,0
759985267390294_1568364683219011,"Anyone have an Instagram connection that could maybe help escalate a support ticket? I have a founder friend whose 50,000+ follower Instagram account got stolen and they can't get back in.",Jacob Torrence,,status,,2017-04-11 15:07:47,0,3,0,0,0,0,0,0,0
759985267390294_1568248599897286,"Is anybody here bullish on Snap, Inc. Longterm?",Michael Dunworth,,status,,2017-04-11 12:50:47,4,10,0,4,0,0,0,0,0
759985267390294_1565762766812536,"What are your thoughts on this? Are all social media platforms starting to look the same?

source: recode",Shaban K. Samani,,photo,https://www.facebook.com/photo.php?fbid=10212514044667267&set=gm.1565762766812536&type=3,2017-04-09 13:39:12,51,11,0,45,2,0,2,1,1
759985267390294_1568071586581654,which is your favorite theme in ZSH Terminal ??,Harsh Shah,,status,,2017-04-11 09:25:03,2,16,0,2,0,0,0,0,0
759985267390294_1569063846482428,"I'm collecting information on what aspects people like to use social media for. A friend and I working on putting some features into our app and it's leading us down a bit of a rabbit hole in terms of what to implement. To help guide us out, I'm hoping your feedback can help give us a little bit of direction. It would take 2 minutes and be much appreciated!",Andrew Alsante,Social Media Survey by Ditto,link,https://goo.gl/forms/CHCtn5F8BuDaJILe2,2017-04-12 06:18:59,0,1,0,0,0,0,0,0,0
759985267390294_1568333049888841,is there any startup working to overcome  car traffic jam other than Elon Musk's hyperloop concept?,Samuel Terefe,,status,,2017-04-11 14:29:58,0,5,0,0,0,0,0,0,0
759985267390294_1568523836536429,"Have any of you used TypeScript before? Slack just migrated their code base from JS to TypeScript, and wrote about the experience, so I thought I'd ask.

",Dave Voyles,TypeScript at Slack – Several People Are Coding,link,https://slack.engineering/typescript-at-slack-a81307fa288d,2017-04-11 18:54:00,21,9,1,21,0,0,0,0,0
759985267390294_1568887839833362,"For anyone interested in VR with some time to kill, Berkeley club Upsync is hosting a 6-hour speed hackathon April 29th with HTC and Fulldive. Below is the blurb for and link to it.

Want to meet with CEO of HTC Cher Wang, learn about cutting-edge VR product and win HTC VR headset with your graphic design/coding project? Come to 2017 Cal VRathon!
SIGN UP here: https://www.eventbrite.com/e/2017-cal-vrathon-coding-and-graphic-design-competition-tickets-33420432413?utm-medium=discovery&utm-campaign=social&utm-content=attendeeshare&aff=esfb&utm-source=fbm&utm-term=eventcard

2017 Cal VRathon: Coding and Graphic Design Competition aims to bring together the brightest minds from Berkeley, Stanford and many other bay area schools. With a goal to create more new ideas and at the same time give students immersive experience and education about Virtual Reality, we plan to organize speaker event and virtual reality hackathon in this one day event. This is a wonderful opportunity for attendees to meet with other VR engineers, companies, and learn about front-end VR software and hardware technology by interacting with leaders in the industry. Our mission is to give participants an immersive experience with virtual reality and at the same time help shape the future of virtual reality by providing the stage for talented student developers to create and innovate.

Food and drinks will be provided****
Website here: WEBSITE DOMAIN
Time & Location: April 29th 1-6PM @ Bay View Room
Website here: https://fulldive-hackathon.herokuapp.com/index.html# bit.ly/calvrhack

Facebook event here for more info:
https://www.facebook.com/events/810956779067725/?notif_t=plan_user_invited&notif_id=1491862093516353",Kelly Young,2017 Cal VRathon: Coding and Graphic Design Competition,link,https://www.eventbrite.com/e/2017-cal-vrathon-coding-and-graphic-design-competition-tickets-33420432413?utm-medium=discovery&utm-campaign=social&utm-content=attendeeshare&aff=esfb&utm-source=fbm&utm-term=eventcard,2017-04-12 02:27:31,4,0,0,4,0,0,0,0,0
759985267390294_1568829559839190,"Hello !
Is there any student who has done internship from Amazon, Hyderabad?
Kindly let me know..I need ua help.
TIA 😊",Sharvani Ramshetty,,status,,2017-04-12 01:10:32,5,0,0,5,0,0,0,0,0
759985267390294_1568249709897175,"Upgrading from iOS 9.2.1 to 10.3. 
What's new?",Dave Fontenot,,status,,2017-04-11 12:52:26,2,17,0,2,0,0,0,0,0
759985267390294_1568431029879043,"HackCWRU brings together the brightest and most creative students to promote unrestricted technological innovation.

Hosted in Cleveland at Case Western Reserve University, hundreds of students will spend 24 hours bringing their imagination into the real world. Work with peers and mentors to create projects in one of six diverse (optional) project tracks: arts, health, fintech, maker, civic, or open source.

Come lend your expertise, and design creative solutions to pressing real-world problems. Registration is free, and the food will be top notch. Sign up: ",Вениамин Ройтеньберг,HackCWRU,link,http://hack.cwru.edu/,2017-04-11 16:36:23,10,5,0,10,0,0,0,0,0
759985267390294_1567910363264443,"Hello, I was registering a domain for my portfolio but I saw that .com and .me is taken, what do you suggest me to buy?

thanks a lot",Abdul Wahab Abrar,,status,,2017-04-11 06:30:28,5,26,0,2,2,0,0,1,0
759985267390294_1565097680212378,"Ok, so people love the free software movement and commercialising the software is a bad thing, right? But what about the developers who invested their time in learning to build software and then actually built it? Does their time have no value? Like the people behind (say) Ubuntu. They devoted their time learning and building skills and then actually put their skills to build something and then, they give it away for free... why? for the betterment of the society like Batman, who risks his life so that Gotham is safe from criminals? I don't get it. How will software devs survive if they distribute their work for free?",Rahul Gupta,,status,,2017-04-09 02:00:28,37,40,2,26,1,0,9,1,0
759985267390294_1567348429987303,,James Biswas,WIRED,link,http://bit.ly/2o07TWS,2017-04-10 19:38:32,15,2,0,15,0,0,0,0,0
759985267390294_1568670029855143,I've just published part 10 of my React-Native tutorial with NodeJs. In this video I add Passport.js and Passport-JWT for the authentication part. I setup the project too to make facebook and google login for the next video. I also show how have babel to compile for production code.,Emanuel Quimper,React-Native & Node Tutorial - Build a Meetup app [Part: 10],video,https://www.youtube.com/attribution_link?a=D89soJdF7pM&u=%2Fwatch%3Fv%3DFFD4lKZCHS0%26feature%3Dshare,2017-04-11 21:37:42,4,0,0,4,0,0,0,0,0
759985267390294_1567497116639101,What's your prefered languages/framework for your personal/portfolio site?,Anthony Attard,,status,,2017-04-10 22:49:45,2,12,0,0,2,0,0,0,0
759985267390294_1568584906530322,"Hi everyone! I'd like to invite all Spyder IDE users (Linux and OSX specific) to test a new plugin that I've written, it allows to execute a local bash terminal inside Spyder. It's my first release, and I would like to have some feedback and comments. It is available through https://github.com/spyder-ide/spyder-terminal and also it is published on pip (Anaconda version soon)",Edgar Andrés Margffoy Tuay,spyder-ide/spyder-terminal,link,https://github.com/spyder-ide/spyder-terminal,2017-04-11 20:05:02,2,0,0,2,0,0,0,0,0
759985267390294_1568496086539204,Seems pretty cool,Alvin Lin,Hacking News & Tutorials,link,https://fossbytes.com/pc-in-a-mouse/,2017-04-11 18:08:34,23,3,2,22,1,0,0,0,0
759985267390294_1567574353298044,"Seeking people to study coding questions with me on Codility and HackerRank! I'm a senior software engineer who wants to sharpen my data structures/algorithms and prepare for Amazon-level software interviews. If you live in LA, even better; we could meet in person! Otherwise, I'm happy to meet by Skype.

I'm almost finished with all 17 Codility lessons and have successfully done dozens of problems, with strict Big O time and space complexities. Seeking regular study partners so I don't go crazy explaining algorithms to walls.

On my future list: ""Cracking the Coding Interview."" If you're seriously interested in rigorously going through any of these 3 sources, please contact me!

My Skype: rayning3. I just created a Skype study group and will add everyone to it who's interested.

To join our Skype study group, go here: https://join.skype.com/O3yUoLQepamf",Raymond Gan,,status,,2017-04-11 00:20:31,9,17,1,9,0,0,0,0,0
759985267390294_1568468493208630,"Does anyone know how to implement this kind of mouseover effect? Any codepens or repos would be very helpful. Trying to do something similar on an ecommerce Wordpress site. All advice is appreciated.

",Austin T. Byrd,Durand Eyeglasses in Deep Sea Blue Fade for Men | Warby Parker,link,https://www.warbyparker.com/eyeglasses/men/durand/deep-sea-blue-fade,2017-04-11 17:24:41,0,3,0,0,0,0,0,0,0
759985267390294_1567594973295982,"I recently customized my Ubuntu system to look like a hybrid mac/linux system (honestly looks like elementary now), does anyone know of any good icon packs that give you a macOS feel (but for dark theme)?

",Ronak Shah,Installing Ubuntu (coming from Mac),link,https://blog.ronakshah.net/Installing-Ubuntu-Like-A-Mac-User/,2017-04-11 00:45:12,19,9,0,17,1,1,0,0,0
759985267390294_1567390756649737,Does anyone know of a free program for translating an audio file into text?,Caroline Hylton,,status,,2017-04-10 20:44:50,4,14,0,4,0,0,0,0,0
759985267390294_1568379039884242,"Guys, I made a tutorial for building a rest api for one of my classes, if you're interested in NodeJS and how to build the backend of an app or web app this should be useful for you

",Deep Patel,deep7176/hello-api,link,https://github.com/deep7176/hello-api,2017-04-11 15:27:15,10,2,1,9,1,0,0,0,0
759985267390294_1568403063215173,"Yes, I'm Ready. 🚀 -- Getting Women to Believe in Their Own Career Preparedness. Please join us for a panel discussion with senior leaders in Tech. 💡Quick look at our speakers: Michelle Zatlyn, Co-Founder, Cloudflare, Inc.; Erin Teague, Head of Product (VR/AR), YouTube; Jocelyn Ding, COO, OmadaHealth; Vidya Peters, VP Corporate Marketing, MuleSoft. 👉 Please RSVP: ",Claire Lee,"Panel on April 24th: Yes, I'm Ready. Getting Women to Believe in Their Own Career Preparedness.",link,http://goo.gl/rd7Rm9,2017-04-11 15:59:48,3,0,0,3,0,0,0,0,0
759985267390294_1567398503315629,"APPLICATIONS LIVE NOW

Coding it Forward is bringing a paid (+housing&travel) Silicon Valley-esque internship program to federal government agencies!!! We're looking for data scientists/software engineers, product managers, designers, and data journalists!

Interviews begin THIS Thursday (!!!), and applications will be accepted on a rolling basis until all eight positions are filled, which will be no later than Friday, April 28, 2017.

Apply here: ",Athena Kan,Civic Digital Fellowship | Coding it Forward,link,http://codingitforward.com/fellowship/,2017-04-10 20:57:02,70,12,4,63,6,1,0,0,0
759985267390294_1567496076639205,"Out of curiosity, how many times do you usually check Github a day outside of work (for any reason)?",Domingo Hui,,status,,2017-04-10 22:47:57,5,2,0,5,0,0,0,0,0
759985267390294_1566076860114460,should #dundermifflin sponsor internapalooza?,Li Xuanji,,photo,https://www.facebook.com/photo.php?fbid=10154817867953751&set=gm.1566076860114460&type=3,2017-04-09 18:26:58,25,10,0,18,0,1,6,0,0
759985267390294_1567268269995319,Question: Would you go to a hackathon that was held outside under large tents if it was held when the weather was comfortable?,Christopher Frederickson,,status,,2017-04-10 17:56:13,10,9,0,7,2,1,0,0,0
759985267390294_897793066942846,I personally think that they teach way too much math garbage in our computer science curriculum. They should scrap it all and focus on memes and funding. I personally think that memes and computers are the same thing anyway,Nick Sahler,,status,,2014-11-01 17:24:09,62,11,0,62,0,0,0,0,0
759985267390294_1568237879898358,Are you aiming this http://www.sequoiahack.com ?,Sandeep Acharya,Sequoia::Hack 2016,link,http://www.sequoiahack.com/,2017-04-11 12:38:36,0,0,0,0,0,0,0,0,0
759985267390294_1568064993248980,"For building web services:  
Restify > Express?",Varun P,,status,,2017-04-11 09:16:46,1,2,0,1,0,0,0,0,0
759985267390294_1567869673268512,"Hi, anyone really familiar with Apple Photos? I'm cautiously trying the app on my macbook, and wondering if after importing a photo to Apple Photos, I can delete the original file without worrying about any data loss (such as unwanted resizing, etc). For testing, I was comparing the size of original photo vs photo that was imported to Photos and pulled back to Finder (drag & drop), and right now I'm thinking the difference (79 bytes out of 1.4 MB total size) might be coming from name change (to prevent duplicates, the second file was automatically re-named 'original 2.jpg'), but what else could be happening behind the scenes?",SoYoung Park,,status,,2017-04-11 05:43:48,1,6,0,1,0,0,0,0,0
759985267390294_1568166476572165,"Does anyone have any suggestions for the best code academy in LA? I know there are great ones in the bay (hack reactor, app academy, etc) but my friend doesn't want to move to the bay. Thanks!

I have been doing some research online but I was hoping to get some personal testimonies, so if you or anyone you know has some experience -- good/bad/neutral -- with any LA code academy please post about it",Christopher McLaughlin,,status,,2017-04-11 11:17:59,2,1,0,2,0,0,0,0,0
759985267390294_1566609796727833,Will a raspberry pi 3 model B support 4k videos ? And will it run smooth ?,Athul Blesson,,status,,2017-04-10 05:37:17,6,17,0,1,1,1,2,1,0
759985267390294_1566421503413329,"[Serious]

Does anyone know how to print JSON in some sort of textarea that displays like code?

If I just do <textarea value={data} /> where data is:
data = JSON.stringify(obj, undefined, 4);

I get a bunch of escaped json in the text area. I was really hoping for it to look like this:

{
  key: 'value',
  key2: 'value2
}",Anthony Alayo,,status,,2017-04-10 01:39:31,2,5,0,2,0,0,0,0,0
759985267390294_1568080116580801,"ISDEV2017 HACKATHON 

ABOUT ISDEV
ISDEV (Innovative software developers) is a tech meet up program created to support and train individuals and students, training them to create smart software's and applications that support all platforms.

The event
ISDEV Hackathon is a weekend dedicated to you and too many hackers, developers and programmers. Collaborate and build creative solutions to problems, while pushing the limits of your mind and body to make something amazing. This event would also showcase interesting artifacts and innovations. We are a young and upcoming group with determined and innovative individuals and this is our first gathering. We have been making preparations to host this event in a more dynamic and unique way with lots of activities.

What is inclusive?
Come as you are. We make sure you have everything you need to carry out your craziest ideas—amazing mentors, delicious food, and a fun work environment. We are also giving out cash prizes to winning teams.

Register Now isdev2017.eventbrite.com

For Sponsorship and Promotion Contact Segun Joshua Via mail brindocorp@gmail.com",Segun Joshua,Photos from Segun Joshua's post,photo,https://www.facebook.com/photo.php?fbid=1420241361331012&set=gm.1568080116580801&type=3,2017-04-11 09:34:51,4,0,1,4,0,0,0,0,0
759985267390294_1568038589918287,A new tool for training end to end object detection models with CNTK and YOLO.,Ari Bornstein,End to End Object Detection in a Box,link,https://www.microsoft.com/reallifecode/2017/04/10/end-end-object-detection-box/,2017-04-11 08:49:35,8,0,0,8,0,0,0,0,0
759985267390294_1566039136784899,"I am generally a very calm & helpful person but just wanted to follow-up on a post I saw yesterday here about the StackOverflow community being d***s and all.
Here's an example of me trying to help someone there, and how eventually my passive aggressiveness gets triggered by his replies.

I know that my last reply was overly harsh, but really!??

(this is from the comments section of a question on StackOverflow)",Marwan Alani,,photo,https://www.facebook.com/photo.php?fbid=10154215618151599&set=gm.1566039136784899&type=3,2017-04-09 17:45:47,41,14,0,38,0,2,0,0,1
759985267390294_1567959343259545,"Hacking as a service?
",Harsh Jani,"Security startup Synack scores $21 M investment from Microsoft, HPE and Singtel",link,https://techcrunch.com/2017/04/11/security-startup-synack-scores-21-m-investment-from-microsoft-hpe-and-singtel/?sr_share=facebook,2017-04-11 07:14:01,1,0,0,1,0,0,0,0,0
759985267390294_1567141786674634,"Need help finding a keylogger for OSX. I want to answer questions like, ""how often do I use caps lock"", ""how often do I use the option key""",Avishaan Singh Sethi,,status,,2017-04-10 15:17:11,2,3,0,2,0,0,0,0,0
759985267390294_1566396396749173,Hey fellow Hackers. I Have a Chatbot Who Helps you Before a date. During the date (limited messaging) And after a date. Looking for early feedback. If you're interested. Just comment below or message me.,Sal Kuyateh,,status,,2017-04-10 00:50:39,4,3,0,4,0,0,0,0,0
759985267390294_1567690389953107,"[serious]
How to connect ReactNative with PostgreSQL in AWS
Thanks in Advance :)",Saeed Motamed,,status,,2017-04-11 02:40:32,1,2,0,1,0,0,0,0,0
759985267390294_1567714303284049,"Hello guys,

I need your help .I wanna build a platform that helps students to learn in a much easier way STEM (Science,Technology,Engineering,Mathematics) school objects and also teachers to teach in a more efficient.I want to make the interaction between student and teachers more efficient and both sides to feel appreciated.
Can you please share your experience during highscool/college, how would you improve the system and ideas of what this platform should contain.

Thank you very much!",Carmen Mitru,,status,,2017-04-11 03:26:12,2,0,0,2,0,0,0,0,0
759985267390294_1567228586665954,Do any of you guys know how to make a chat bot using past conversation data? Are there any easy APIs for this?,Joe Thomas,,status,,2017-04-10 16:56:05,3,3,0,2,1,0,0,0,0
759985267390294_1566530893402390,"[Serious]
ReactXP or ReactNative?",Saif Rahman,,status,,2017-04-10 03:40:21,1,11,0,1,0,0,0,0,0
759985267390294_1567633283292151,"Hi everyone, 
I want to compare the detection rate for sinkhole attacks by three different Intrusion Detection Systems in Wireless Sensor Networks. I am planning to use NS2 for network simulation. However, I have no prior experience with network simulation. I'd appreciate any suggestions and resources that might help me accomplish the comparison. Thanks.",Pradip Khanal,,status,,2017-04-11 01:35:00,5,0,0,5,0,0,0,0,0
759985267390294_1566360536752759,Can Java be faster than Python3 on prototyping an web app?,Kiu Lam,,status,,2017-04-09 23:47:32,9,14,0,8,1,0,0,0,0
759985267390294_1567188900003256,Has anyone had any experience using the UberRides SDK for iOS (specifically with Swift 3)? I'm having issues with the SSO authentication process and would really appreciate any help!,Ashvin Vinodh,,status,,2017-04-10 16:11:36,4,1,0,3,1,0,0,0,0
759985267390294_1567013196687493,"This was probably a stupid idea in retrospect.
gulpfile -> makefile -> more makefiles -> .tex -> PDF",Alvin Lin,Automating My Personal Note-Taking Compilation System,link,https://hackernoon.com/automating-my-personal-note-taking-compilation-system-415696705657,2017-04-10 13:09:22,6,1,1,6,0,0,0,0,0
759985267390294_1566832093372270,"Some interesting news in the container / orchestration world this morning:

",Amy Chen,Deis to Join Microsoft,link,https://deis.com/blog/2017/deis-to-join-microsoft/,2017-04-10 09:53:27,9,2,1,8,1,0,0,0,0
759985267390294_1566165540105592,Act out your inner black hat,Phil Chen,'Mr. Robot' Season 3 Casting Call for Hacker Types,link,http://www.projectcasting.com/casting-calls-acting-auditions/mr-robot-season-3-casting-call-hacker-types,2017-04-09 20:07:34,224,36,10,203,9,2,9,0,1
759985267390294_1567141633341316,[Serious] So I have this issue with ie11 on Windows 7 not sure why but it won't let my use my js functions until i reload from the link in the address bar. Refreshing and f5 won't help. I think it could have something to do with onbeforeunload or https because the code works fine locally and on chrome and Firefox. What are your guys thoughts?,Brad Eagle,,video,https://www.facebook.com/1307490962664583/videos/1298479353565744,2017-04-10 15:16:51,4,7,0,4,0,0,0,0,0
759985267390294_1567339813321498,Quora behaving like this right now.. :/,Ankit Arya,,photo,https://www.facebook.com/photo.php?fbid=1033599430103388&set=gm.1567339813321498&type=3,2017-04-10 19:24:58,10,0,0,7,0,1,0,2,0
759985267390294_877827015606118,I wrote a response to an article posted here. I'd love for you to read it and give me some feedback!,Alexander Gould,"Why we need ""Nerd Culture"" now more than ever.",link,https://medium.com/@alexandergould/why-we-need-nerd-culture-now-more-than-ever-b7072228b43d,2014-10-13 22:51:42,11,11,0,11,0,0,0,0,0
759985267390294_1556050634450416,"Now make any product Snapchat with SaaS (Stories as a Service)!

",JJ Tang,Stories as a Service,link,https://storiesasaservice.com/,2017-04-01 14:46:12,591,24,14,393,13,0,181,4,0
759985267390294_1567243676664445,"Those of you on windows with multiple monitors, do you hate the Slack app as much as I do?

It keeps bleeding over into other monitors when maximized. So damn annoying.",Hamza Khan,,status,,2017-04-10 17:16:58,0,0,0,0,0,0,0,0,0
759985267390294_1564501373605342,"""the DoL hasn't provided [Google] with information about its methodology or data to support [its claims]"" This is another example of making claims that have not been verified or researched thoroughly yet, and then attempting to ruin the reputation of a company. I doubt there's a pay gap within Google in the first place. 

But what do I know! Time to delete Google alongside Uber now! /sarcasm

",Lucas Terry,Department of Labor claims that Google systematically underpays its female employees,link,http://www.theverge.com/platform/amp/2017/4/8/15229688/department-of-labor-google-gender-pay-gap,2017-04-08 13:44:17,102,26,5,64,1,8,6,17,6
