status_id,status_message,status_author,link_name,status_type,status_link,status_published,num_reactions,num_comments,num_shares,num_likes,num_loves,num_wows,num_hahas,num_sads,num_angrys
759985267390294_1570882279633918,"{serious}
Anyone here working for Facebook?

Have a potential client (family friend) who contacted me about their site being blocked by facebook. They had not renewed their domain and had a fair amount of traffic to the site. They ended up getting their domain back but now facebook/insta continually blocks for being spam. I suspect the temporary owner had backlinked/send people around and it got reported.

All I've found is an automated response to report it, but have had no luck so far to get it unblocked.

Any help would be nice! Thanks guys!",Tyler Hall,,status,,2017-04-13 19:07:01,1,2,0,1,0,0,0,0,0
759985267390294_1569586639763482,"Hello! 
How difficult is it to find software jobs outside of the US right after graduation? Any success stories?",Morgan Monzingo,,status,,2017-04-12 15:14:21,4,2,0,4,0,0,0,0,0
759985267390294_1571143539607792,Anybody catch the whole YouTube Kerfuffle a handful of hours ago?,Matthew Dunphy,,status,,2017-04-14 00:21:47,0,4,0,0,0,0,0,0,0
759985267390294_1569983606390452,How to deal with client that mentions they only have a PC after the iOS app has been built? (Haven't been paid yet),Tolga Beser,,status,,2017-04-13 00:04:54,6,4,0,0,0,1,0,5,0
759985267390294_1569895519732594,"Looking for some advise here.

Whenever I build an application using Python/JS etc, it mostly comprises of googling functions/semantics/instances, going to stack-overflow again and again to see how that library works, occasionally copy-pasting jQuery snippets etc, you get the idea.

I want to know if this is a bad thing in the longer run? I believe that nobody writes 100 lines of code (non-trivial applications) perfectly without googling even once. I'd like to know what the software engineers think of this.",Jack Reacher,,status,,2017-04-12 22:12:39,6,9,0,6,0,0,0,0,0
759985267390294_1569589339763212,Anyone here pro in SQL can help me out? :3,Loc Tran,,status,,2017-04-12 15:18:30,1,4,0,1,0,0,0,0,0
759985267390294_1569838369738309,"Especially in this group and other big groups like it, I hate it when I am typing a seemingly common word like ""there"" or ""perfect"" and I end up accidentally tagging someone that i've never met or interacted with in any way.",Hamza Khan,,status,,2017-04-12 20:44:24,4,2,0,3,0,0,1,0,0
759985267390294_1568390753216404,"Hey Friends! If I wanted to send passwords securely (without forcing the receiver to download a program), what would be the best option?",Dennis Yu,,status,,2017-04-11 15:43:05,1,17,0,0,0,0,1,0,0
759985267390294_1568442836544529,"When somebody wants your help building an app and

1.) They have no CS background (forgivable)

2.) They have no business background 

3.) They can't explain what their app actually does

4.) They can't identify their target audience

5.) They have no money, ""but I'm telling you, it's gonna work, man, this is our ticket out of the rat race!""",Christopher Jones,,status,,2017-04-11 16:53:45,169,30,5,119,1,0,44,5,0
759985267390294_1570668966321916,"Not always. Not everywhere. Stories. 

""No one is using Facebook stories, so it turned your friends into ghosts"" ~Verge",Rohit Bhatia,"No one is using Facebook stories, so it turned your friends into ghosts",link,http://www.theverge.com/2017/4/5/15189148/facebook-stories-friends-ghosts-news-feed-snapchat,2017-04-13 14:28:22,65,8,0,36,2,0,27,0,0
759985267390294_1570992512956228,Anybody here have experience with the Google Charts API? I'm trying to figure out if you can drill down in them or not otherwise does anyone have a suggestion on how to replicate such behavior? Maybe open the next layer in another window?,Tony Tran,,status,,2017-04-13 21:07:15,0,0,0,0,0,0,0,0,0
759985267390294_1569480523107427,,Leo Gonsalves,Techarena51,link,http://www.theregister.co.uk/2017/04/12/prisoners_built_computer_connected_to_states_network/?utm_source=FB-Techarena51.com,2017-04-12 13:11:29,61,4,0,46,1,8,6,0,0
759985267390294_1569842913071188,Guys anyone is here who has already worked on Arduino or Raspberry Pi device? I need help of you;,Krishna Sharma,,status,,2017-04-12 20:51:38,2,4,0,2,0,0,0,0,0
759985267390294_1569993116389501,"Okay so i woke up this morning and my iphone deleted my text messages, call log, contacts and all my photos are gone too. Help?",Andrew Toews,,status,,2017-04-13 00:20:31,3,14,0,2,0,1,0,0,0
759985267390294_1570505173004962,"Hey guys, I'm a Front-End developer trying to learn some UI/UX skills. I have only used Ionic till now as I knew Angular. I'd like to ask some tools/programs that UI/UX designers use in everyday life e.g. Sketch, PS etc. For instance, is there any software that people use to render an image of their app's view in a phone as I have seen that in many portfolio websites.",Jack Reacher,,status,,2017-04-13 11:30:26,2,1,0,2,0,0,0,0,0
759985267390294_1569677436421069,Next hackathon project,Rolando Cruz,Hacker News,link,https://www.twilio.com/blog/2017/04/wedding-at-scale-how-i-used-twilio-python-and-google-to-automate-my-wedding.html,2017-04-12 17:09:37,230,12,9,181,15,3,30,1,0
759985267390294_1570847622970717,"Hey guys, if you're in the LA area and are interested in VR/AR/MR, check this out!! They are showcasing tons of amazing VR projects, have keynotes from the CEO of Unity and the co-producer of Rick and Morty! Also, I'll be demoing my VR project, DIVR Edu!",Nathan Kong,VRLA Expo 2017,event,https://www.facebook.com/events/716197035195595/,2017-04-13 18:17:17,1,0,0,1,0,0,0,0,0
759985267390294_1568363479885798,"Hey, everyone! I'm an organizer for HackCWRU 2017 and I'm putting together a list of Hacker Resources for our attendees. We're doing a track system this year: Health, Maker, Civic, FinTech, Open Source, and Art. If anyone has any links they think would make a good resource I'd appreciate it if you'd share it with me. Thanks!",David Fann,,status,,2017-04-11 15:06:08,3,1,0,3,0,0,0,0,0
759985267390294_1570664726322340,"Hey hackers. I'm one of the cofounders of VoiceOps (voiceops.com), AI platform for analyzing enterprise voice conversations, and wanted to share that we're currently answering Q's on HN (news.ycombinator.com). Would love to chat about anything ML/voice/enterprise related.",Daria Rose Ev,,status,,2017-04-13 14:23:10,16,3,0,16,0,0,0,0,0
759985267390294_1570684399653706,"Hi everyone,
A group of developers and I are looking into developing an app to replace the college rideshare facebook pages. Please help us out by taking this short survey! 🙂 Any other feedback is welcome!

",Ryan Yue,Rideshare App Survey,link,https://goo.gl/7f6LRP,2017-04-13 14:52:05,3,0,0,3,0,0,0,0,0
759985267390294_1570555422999937,I packaged up figlet and lolcat to make it easier to use. Github --> https://github.com/jayliew/baller-af  https://media.giphy.com/media/26gR0AU7SPRM0n8Va/giphy.gif,Joe Liew,media.giphy.com,link,https://media.giphy.com/media/26gR0AU7SPRM0n8Va/giphy.gif,2017-04-13 12:19:47,3,3,0,3,0,0,0,0,0
759985267390294_1570660976322715,"Hey hackers,

Wrote up the next tutorial in an Ethereum blockchain development series on how to configure an Ethereum node using Go-Ethereum on AWS. This one walks through how to initiate your genesis block and track chaindata.",Michael Gord,Use Go-Ethereum to Setup an Ethereum Blockchain on AWS - Part 2 | MLG Blockchain,link,https://www.mlgblockchain.com/setup-ethereum-on-aws-2.html,2017-04-13 14:17:46,5,0,0,5,0,0,0,0,0
759985267390294_1569543389767807,"I remember a while back seeing a nerual network that was trained on a specific dataset and then ran in ""reverse"" (so it was given the output and told to make the input) essentially making a ""creative"" network. I don't remember where I saw it though or what to even look up to find it again.. Has anyone seen this? Is there a paper on this topic?",Eddie Penta,,status,,2017-04-12 14:31:18,5,5,0,4,0,1,0,0,0
759985267390294_1569900446398768,"JS help
    var axisX = {};
    axisX += 1;
    axisX += 2;
    console.log(axisX);
    console.log(axisX[15]);
    console.log(axisX[16]);

Why does it output 1 and 2 at position 15 and 16?",Ali Malik,,status,,2017-04-12 22:21:20,1,5,0,1,0,0,0,0,0
759985267390294_1568546546534158,"Hey everyone! 

I often get asked how I tricked out my terminal, so I thought I'd write a blog post on it.

(TL;DR -> Oh-My-Zsh is amazing)

",Ronak Shah,Making Terminal Great Again,link,https://blog.ronakshah.net/Making-Terminal-Great-Again/,2017-04-11 19:20:57,16,3,0,15,1,0,0,0,0
759985267390294_1570636439658502,Useful to those of you raising...,Jay Zalowitz,Seed Fundraising — How to Handle an Angel Investor Meeting,link,https://hackernoon.com/seed-fundraising-how-to-handle-an-angel-investor-meeting-a1110cf2384b,2017-04-13 13:44:17,1,0,0,1,0,0,0,0,0
759985267390294_1570622682993211,"Why hadoop is named hadoop:
",Jessie Salas,Doug Cutting: The Name of Hadoop - Intro to Hadoop and MapReduce,video,https://www.youtube.com/watch?v=irK7xHUmkUA,2017-04-13 13:27:43,1,0,0,1,0,0,0,0,0
759985267390294_1570004763055003,Hey Hackers! I just wrote a medium post about my first experience as a hackathon organizer! Check it out! https://medium.com/@xTEddie/from-hacker-to-organizer-44fd61a86150 :),Edward Tran,From Hacker to Organizer – Edward Tran – Medium,link,https://medium.com/@xTEddie/from-hacker-to-organizer-44fd61a86150,2017-04-13 00:37:12,10,1,0,10,0,0,0,0,0
759985267390294_1569262839795862,"When people here talk about personal blogs/websites, are they talking about profortlio (showcase, resume, etc) and technical article for their professional gain? Or just literally websites for themselves​, or a blog of personal thoughts and reflections?

I'm wondering because I'm not sure what kind of contents is considered ""normal"" for a ""personal website/blog"". Do recruiters actually browse these kind of websites? Thanks.",Jane Manchun Wong,,status,,2017-04-12 09:56:54,14,6,0,14,0,0,0,0,0
759985267390294_1570613716327441,"HackerNest and the NCSC have over $30K+ in Cash & Prizes to give away!!!
- Trip for your team to demo at the NCSC's Court Technology - Conference in Salt Lake City, September 12-14, 2017
- Dinner with the Chief Justice of the New Jersey Supreme Court
- Lunch with the New Jersey Courts Administrator and Chief Information Officer
- Invaluable mentorship and industry connections
Enter now at courthack.org
 http://courthack.org",Annika Thurlow,CourtHack: Making justice fair and accessible for all,link,http://courthack.org/,2017-04-13 13:17:13,3,0,0,3,0,0,0,0,0
759985267390294_1570426003012879,"Any examples of a contract a ""loaner"" should sign when loaning hardware? Talking about projects longer than just a weekend.",Joakim Isoaho,,status,,2017-04-13 10:22:55,3,1,0,3,0,0,0,0,0
759985267390294_1560259157362897,"We're so excited!!
Anyone want to help test a A.I secret new beta?
m.me/mebabybot",Nofar Albarak,,status,,2017-04-05 07:44:20,7,5,0,6,1,0,0,0,0
759985267390294_1570491373006342,"[serious]
What would you recommend I read, watch, or develop in order to be qualified for an entry/junior level android developer position?",Juan Romo,,status,,2017-04-13 11:16:53,2,0,0,2,0,0,0,0,0
759985267390294_1570152109706935,"Just google ""Star Trek: The Next Generation"" and read the description. Is that some indexing error or is Google Drunk :P",Lovekesh Garg,,photo,https://www.facebook.com/photo.php?fbid=1876007329284098&set=gm.1570152109706935&type=3,2017-04-13 04:10:35,5,4,0,5,0,0,0,0,0
759985267390294_1570323036356509,"[serious] I currently use the MacOS Terminal app, but I know that there are many people who prefer iTerm 2 or another application. What is your go-to app, and why did you choose it over the default one?",Andrew Donnell,,status,,2017-04-13 08:23:59,0,1,0,0,0,0,0,0,0
759985267390294_1570439906344822,,Adam McNeilly,WXYZ-TV Channel 7,video,https://www.facebook.com/wxyzdetroit/videos/10154342872726135/,2017-04-13 10:37:43,7,0,0,5,2,0,0,0,0
759985267390294_1570302279691918,"This seems to be a harder problem than it sounds. I have hundreds of PDF files, each file containing more than one page. What I want to do is programmatically REDACT (not extract) a residential home address.

Does anyone have any idea how? Caveat: A straight up string search in PDF doesn't always work (because text can be an encoded byte stream or bitmap). Possible workaround: programmatically converting to image, then cutting out the address by hand?",Joe Liew,,status,,2017-04-13 08:03:38,0,3,0,0,0,0,0,0,0
759985267390294_1569664416422371,Hey does anyone ever end up bringing their own hardware to hackathons?,Robert Rose,,status,,2017-04-12 16:45:57,7,13,0,7,0,0,0,0,0
759985267390294_1569549296433883,"Hi Everyone! I'm very interested in getting into programming and want some opinions on the best point of entry. 

I am interested in learning some programming so that I can apply it to AI, data science, vr/ar, etc. I'm not interested in web or application development. 

Any recommendations on first languages to learn and where to access classes?

Thanks!",Jacob Roscoe,,status,,2017-04-12 14:38:45,2,5,0,2,0,0,0,0,0
759985267390294_1569589593096520,"[serious]
can we host web app build on react in godaddy?",Saif Rahman,,status,,2017-04-12 15:18:49,2,10,0,2,0,0,0,0,0
759985267390294_1570151896373623,"[Help] Folks. What dates do you think is the best in the month of July to host online hackathons in these colleges? We are looking for coordinators from the mentioned colleges as well. 

P.S. For details of Indian region which completed on March 11 - dos.lc/codesparta11",Mohammed Rafy,,photo,https://www.facebook.com/photo.php?fbid=1343239219097585&set=gm.1570151896373623&type=3,2017-04-13 04:09:59,0,2,0,0,0,0,0,0,0
759985267390294_1570086033046876,"Hey guys,

This question is for anyone who can answer: Is there a difference between a stupid sort versus bogo sort algorithm? I am trying to understand their differences and I can not find anything around Dr. Google. It seems that my professor is disagreeing with me that stupid sort is completely different than Bogo sort.

What are your thoughts? Is there an actual difference? If so, explain it to me. I appreciate it a lot.

-Z",Zeid Andrés Tisnés,,status,,2017-04-13 02:25:37,1,2,0,1,0,0,0,0,0
759985267390294_1570285149693631,This new AutoDraw from Google is really cool. I could see teams leveraging it in a number of different ways during hackathons.,Anthony Pompliano,Mike Rogers,video,https://www.facebook.com/ChairmanMikeRogers/videos/1519086384782427/,2017-04-13 07:36:22,2,0,0,2,0,0,0,0,0
759985267390294_1570284333027046,"GO-JEK in association with HackerEarth is inviting all Women Developers for SHE-HACK!
GO-JEK is Indonesia's largest startup, and is currently the fastest growing startup in South and South East Asia, growing 900X in the 18 months since launch.

She-Hack by GO-JEK is the platform to engage with the best minds out there. What's even better are the prizes you can win! Grab yourself a Hyundai Grand i10, a Vespa Motorbike or an iPhone 7?

Register now!",Vipin Singh,SHE-HACK on HackerEarth,link,https://shehack.hackerearth.com/,2017-04-13 07:35:00,1,0,1,1,0,0,0,0,0
759985267390294_1570259429696203,Check out what our students have built to hack entertainment!,Kahjunz Koon,NEXT Academy,video,https://www.facebook.com/getschooledbynextacademy/videos/1881469092131033/,2017-04-13 06:59:22,2,0,0,2,0,0,0,0,0
759985267390294_1568911769830969,"Need some help figuring out pricing at Airbnb. 

One of the homes says $150 a night. 

If I'm going for Fri, sat, sun. I arrive Friday morning, and I leave Sunday afternoon, am I paying for 2 nights only? The morning of the third day isn't​ counted?

Or am I paying for 3 nights?

Thanks!",Hamza Khan,,status,,2017-04-12 03:00:57,1,3,0,1,0,0,0,0,0
759985267390294_1569747606414052,"[Serius] Whats the best way to listen/receive data from a webpage using Java?
Without using loops or port forwarding.",Brad Eagle,,status,,2017-04-12 18:31:52,1,4,0,1,0,0,0,0,0
759985267390294_1569674119754734,I remember seeing Parihug at MHacks 6! I love seeing hackathon projects turn into a reality. Good luck to the entire team!,Tristan Wiley,MHacks,link,https://www.kickstarter.com/projects/parihug/parihug-hug-loved-ones-from-anywhere-in-the-world,2017-04-12 17:03:30,43,1,0,35,7,1,0,0,0
759985267390294_1566882403367239,"Which one of you did this? 

",Adam Allard,Someone hacked every tornado siren in Dallas. It was loud.,link,https://www.google.com/amp/s/www.washingtonpost.com/amphtml/news/the-intersect/wp/2017/04/09/someone-hacked-every-tornado-siren-in-dallas-it-was-loud/,2017-04-10 10:51:31,412,25,20,274,6,19,109,2,2
759985267390294_1568532086535604,That background music tho,Louise Lai,"People's Daily, China",video,https://www.facebook.com/PeoplesDaily/videos/1494112020640610/,2017-04-11 19:06:44,185,18,17,158,9,15,3,0,0
759985267390294_1568249856563827,,Alejandro Alonso,Google,video,https://www.facebook.com/Google/videos/10155212940917838/,2017-04-11 12:52:37,386,16,35,323,19,43,1,0,0
759985267390294_1569826603072819,"Will I be seeing any of you at DreamHack Austin 2017?
It's on april 28-30",Hamza Khan,,status,,2017-04-12 20:34:32,1,5,0,0,0,1,0,0,0
759985267390294_1569799149742231,https://www.youtube.com/watch?v=leFuF-zoVzA,Sambhav Dhawan,How I Made My Own iPhone - in China,video,https://www.youtube.com/watch?v=leFuF-zoVzA,2017-04-12 19:53:37,3,0,0,3,0,0,0,0,0
759985267390294_1568473873208092,"Is this real?
https://www.mturk.com/mturk/welcome",Md Malsi,Vocativ,video,https://www.facebook.com/Vocativ/videos/1542723392406557/,2017-04-11 17:33:17,15,15,1,11,0,3,1,0,0
759985267390294_1569792549742891,"Hi fellow Hackathon Hackers!

I'm organizing a collegiate social impact hackathon called SiliconHacks in Fremont, California on May 6-7th (http://www.siliconhacks.com/). 

If you're a tech professional in Silicon Valley/SF Bay Area and would like to share your valuable insight at our opening or closing ceremony and/or judge our innovative projects, please comment below or message me! :) Both technical and business people are welcome! If you have any coworkers, friends, or other contacts that would be potentially interested, please let them know.",Dhanush Patel,SiliconHacks 2017,link,https://lnkd.in/gzqkQiN,2017-04-12 19:41:12,12,0,0,10,0,0,0,2,0
759985267390294_1568657283189751,"Hey guys! Our iOS app just got rejected from the App Store submission due to crashing on iPad under IPv6. We are unable to reproduce the crash, so we want to symbolicate the crash logs provided by the App Store review to see what had happened. 

Now we have the app archive uploaded to the App Store and the downloaded dSYM debug symbols that Apple generated. But it seems that the UUID of the archive and those in the crash logs doesn't match so it's not possible do symbolication.

Anyone meets this problem before, or any recommended solution? I am pretty sure the app archive used now is exactly the same one that was submitted to the App Store. Thanks!",Yingbo Wang,,status,,2017-04-11 21:22:56,5,4,0,5,0,0,0,0,0
759985267390294_1569505733104906,"Does anyone here have experience with image processing, point clouds, and 3d mesh construction in Python? I posted on Stack Overflow for a particular program I'm trying to write, but something tells me it's a bit too specific to get a reply in a reasonable time frame. Here's the post, appreciate any help I can get! ",Dean Dijour,Brain tumor reconstruction as 3D mesh via 2D MRI scans in Python,link,http://stackoverflow.com/questions/43376472/brain-tumor-reconstruction-as-3d-mesh-via-2d-mri-scans-in-python,2017-04-12 13:46:15,5,4,0,5,0,0,0,0,0
759985267390294_1569732056415607,"There's a hackathon coming up and I already know what project I want to work on. But my friends want a business/use case, which is reasonable since we'd have to defend it in front of the judges. I know people typically take some case/problem and then create a project for that case, anyone have any idea on how to find / identify a problem based on a project (broad I know). Where would you start? I'm thinking about the audience,  and general applications of the techniques used. 

Also I built my project idea based on the APIs that would be available, and I did have a use case in mind but I'm not too sure how to refine it so I'm thinking about finding another case, any tips?",Tony Tran,,status,,2017-04-12 18:14:24,0,1,0,0,0,0,0,0,0
759985267390294_1569757219746424,New live stream! Policy gradients outperform DeepMind's DQN (which was the reason google bought them) so it's a strategy worth looking into. We'll use it to solve Pong  ,Siraj Raval,How to Beat Pong Using Policy Gradients,video,https://www.youtube.com/watch?v=PDbXPBwOavc,2017-04-12 18:43:57,3,0,1,3,0,0,0,0,0
759985267390294_1569260403129439,"Are there any tools for visualizing the ""connectome"" of Wikipedia entries?",Jacob Werbin,,status,,2017-04-12 09:53:59,0,1,0,0,0,0,0,0,0
759985267390294_1568385533216926,Amazing!,Ananay Arora,Google,video,https://www.facebook.com/Google/videos/10155212940917838/,2017-04-11 15:36:18,192,2,38,154,19,18,1,0,0
759985267390294_1569701096418703,Anyone have experience with the Oracle programmer certificates and training modules in Java? Were they helpful in learning Java? Did having the certificate open any opportunities for you?,David Herring,,status,,2017-04-12 17:33:15,0,0,0,0,0,0,0,0,0
759985267390294_1568484999873646,Are you guys using IFTTT? do you have some insights? share your setup! 😈,Gal Schlezinger,IFTTT Ideas for Software Development – Gal Schlezinger – Medium,link,https://medium.com/@galstar/ifttt-ideas-for-software-development-fcae4f1f580e,2017-04-11 17:50:38,1,4,0,1,0,0,0,0,0
759985267390294_1568440033211476,anyone here good with graphic design skills? as friend of mine has a startup and is looking for great talent.,Shreyas Moudgalya,,status,,2017-04-11 16:49:04,0,1,0,0,0,0,0,0,0
759985267390294_1568258459896300,today is Windows Vista's end of life day for updates/patches. press F to pay respects.,Вениамин Ройтеньберг,,status,,2017-04-11 13:02:54,20,5,0,11,0,0,0,9,0
759985267390294_1568746773180802,"Attention Hackathon Organizers: 

Does this seem like a good t-shirt distribution for an average Hackathon?

S:20%, M:50%, L:20%, XL:5%, XXL: 5%

Currently ordering shirts for herScript Hacks '17.",Anita Garcia,herScript Hacks 2017,link,http://www.herscripthacks17.eventbrite.com/,2017-04-11 23:14:02,3,6,1,3,0,0,0,0,0
759985267390294_1569608263094653,"Hi guys! You might remember me from the Facebook Bot post. I just wrote a complete tutorial on how anyone can make a Facebook + Reddit bot in Python. It included complete code and explanation. 

It is a Meme, Motivation, Jokes and Shower Thoughts facebook messenger bot which serves you fresh posts whenever you ask it to. 

I hope you guys find the tutorial useful :) 

",Muhammad Yasoob Ullah Khalid,Making a Reddit + Facebook Messenger Bot,link,https://pythontips.com/2017/04/13/making-a-reddit-facebook-messenger-bot/,2017-04-12 15:43:55,67,5,4,59,8,0,0,0,0
759985267390294_1569619906426822,"Do you have an upcoming hackathon? Want to get more attendees? List it on #MakeSchool's Hackathon Directory! We send it out to over 80K people every two weeks.

www.makeschool.com/hackathons

Feel free to share this with your friends!",Evan Hynes,Upcoming Events – Make School,link,http://www.makeschool.com/hackathons,2017-04-12 15:56:44,1,0,0,1,0,0,0,0,0
759985267390294_1569501693105310,"Hey guys and ladies? i have the web template i want to push to my site. but befor that, i want to set the div boxes in the body to have a draggable feature, like that of Twitter. how can i achieve this?

EDIT: the interactive draggable feature will be disabled by default.",Hype Emmanuel Mcee,,status,,2017-04-12 13:39:17,0,3,0,0,0,0,0,0,0
759985267390294_1566073396781473,"Hi guys! I haven't posted in this group a lot. I have basically been a lurker mostly. I just wanted to share something i made pretty recently. It is a Meme, Motivation, Jokes and Shower Thoughts facebook messenger bot. It is not currently approved by facebook (i haven't applied for approval because i dont have time and a website yet. Anybody wanna help? You can add it to your CV!) If you guys want to give it a try just message me or comment below this post. I will add you guys to the testers group and then you just have to send a message to this page (Me) + (my friend) = world's top comedians XD and things should start working.

If you have any questions please let me know. The memes, motivational posts, jokes and shower thoughts are taken from reddit. Some preprocessing is done on the server so that you dont receive any post twice.

I hope you guys like it! <3

P.S: don't blame me if you spend countless hours laughing at the useless jokes it throws at you.",Muhammad Yasoob Ullah Khalid,Photos from Muhammad Yasoob Ullah Khalid's post,photo,https://www.facebook.com/photo.php?fbid=10212687517972776&set=gm.1566073396781473&type=3,2017-04-09 18:25:08,85,29,0,69,0,1,15,0,0
759985267390294_1568407463214733,https://techcrunch.com/2017/02/09/what-software-engineers-are-making-around-the-world-right-now/,Iliad,What software engineers are making around the world right now,link,https://techcrunch.com/2017/02/09/what-software-engineers-are-making-around-the-world-right-now/,2017-04-11 16:07:04,89,16,10,86,2,1,0,0,0
759985267390294_1569484603107019,"We built a robot to test the durability of our new short charging cables, blogged it:
",Andrew J. Chapin Jr.,Let's Break Some Cables – Tiny Cables – Medium,link,https://medium.com/tiny-cables/lets-break-some-short-cables-arduino-robot-testing-c70206f1ab56,2017-04-12 13:13:43,1,0,0,1,0,0,0,0,0
