status_id,status_message,status_author,link_name,status_type,status_link,status_published,num_reactions,num_comments,num_shares,num_likes,num_loves,num_wows,num_hahas,num_sads,num_angrys
759985267390294_1570689756319837,"Apart from .com and .io domains, which other domain extensions are great?",Hype Emmanuel Mcee,,status,,2017-04-13 14:59:51,1,17,0,1,0,0,0,0,0
759985267390294_1574208479301298,Does anyone know how to embed a Facebook photo album onto a website? I've tried Googling it and have had no luck finding something that works.,Brandon Schwartz,,status,,2017-04-16 12:09:54,2,5,0,2,0,0,0,0,0
759985267390294_1573182606070552,"Does anyone here know how to create digital Arabic calligraphy? I'm at the NYU Abu Dhabi hackathon for social good in the Arab world, and we are trying to create a nice quote for our presentation/marketing materials.

This photo is what the quote looks like written out by hand",Erin Hoffman,,photo,https://www.facebook.com/photo.php?fbid=10209042450163799&set=gm.1573182606070552&type=3,2017-04-15 14:49:37,9,9,0,8,1,0,0,0,0
759985267390294_1117131001675717,"Hi everyone. PennApps this weekend was my first hackathon, and to be honest, I didn't really like it. I wrote a satirical article about my experience there. For those of you who attended, I hope you find some amusement in this piece. Any event that happened that seems well within the realms of possibility actually did occur. Any event that didn't happen is made quite obvious in its exaggeration. Enjoy.",Gabe Zavtra,My First Experience at a Hackathon,link,https://medium.com/@Gabraham/my-first-experience-at-a-hackathon-a8494b875b34,2015-09-07 20:40:10,336,67,0,336,0,0,0,0,0
759985267390294_1571183972937082,"YouTube got hacked by OurMine again.  Has anyone heard of them, and what are they?",Jarrod Luca,,photo,https://www.facebook.com/photo.php?fbid=10208717772083048&set=gm.1571183972937082&type=3,2017-04-14 01:07:51,17,12,0,15,0,0,2,0,0
759985267390294_1573107429411403,How many of you attending ongoing YC Startup School founder's track?,Harshit Jaiswal,,status,,2017-04-15 13:27:26,8,5,0,8,0,0,0,0,0
759985267390294_1573528339369312,"Hey all -- Was wondering if anyone here knows of a Facial Action Recognition system(FACS/AU) that I could easily implement? If not, does anyone know of a way to recognize various facial actions(widening of eyes, opening mouth, frowning, etc)? 

Using Python + OpenCV right now for detecting faces. 

Thanks! 
 
PS: Pls no node.js",Stefan Stokic,,status,,2017-04-15 22:12:11,10,5,0,9,1,0,0,0,0
759985267390294_1496350070420473,"[HELP] Does anyone here are from the below-mentioned universities? 
Hosting an online hackathon and need some coordinators from the campus. 

The first six from US, Canada and the next 5 from Asia Pacific region.

Please connect with me if anyone of you have any leads in these campus.",Mohammed Rafy,,photo,https://www.facebook.com/photo.php?fbid=1273849966036511&set=gm.1496350070420473&type=3,2017-02-06 04:06:12,4,18,0,4,0,0,0,0,0
759985267390294_1573263119395834,"If you're in the tri-state area, please check out hackMHS IV, one of the biggest hackathons in NJ. 

It is on May 27th-28th from 12pm to 12pm and is open to high schoolers ages 13-18 years old!

Register now at http://hackmhs.com/",Tejas Gupta,HackMHS IV,event,https://www.facebook.com/events/423053361395784/,2017-04-15 16:40:55,9,5,0,9,0,0,0,0,0
759985267390294_1572344049487741,"I've a python script xyz.py which loads 1GB of data into RAM to process anything given to stdin and gives output to stdout.

Now, to avoid loading again and again,  i want to load this script once and let it run into background and invoke it again and again from some command in cmd and get stdout. Is there a way to implement it ?",Rajan Kumar,,status,,2017-04-14 22:34:55,3,10,0,3,0,0,0,0,0
759985267390294_1573526739369472,"#snackdown 2017 is back! It is a contest organized by Directi every year,participate to compete with the best coders world wide, if you can code you can participate and show your coding skills to the world. Dont miss this golden chance to showoff your skill, HURRY participate asap. ",Vraj Shah,SnackDown 2017 | CodeChef,link,https://goo.gl/sOKsRb,2017-04-15 22:09:31,2,0,0,2,0,0,0,0,0
759985267390294_1573517226037090,"I scrapped together a plugin that help you highlight a website based on a word list. Why? Well, let say you wonder: how much German can I read after finishing that Duolingo's  German course? Just use this plugin and head to German wikipedia, maybe?
Check out ""Esperanto"": https://chrome.google.com/webstore/detail/esperanto/polehohpiildedlcimlencodbghhbcaa?utm_source=gmail
I would love to hear any suggestions. Frankly, if I get one or two new users besides myself, I would be the happiest guy in the universe.
p/s: it is on github too https://github.com/nhamlv-55/Esperanto",Le VN,Esperanto,link,https://chrome.google.com/webstore/detail/esperanto/polehohpiildedlcimlencodbghhbcaa?utm_source=gmail,2017-04-15 21:54:15,4,0,0,4,0,0,0,0,0
759985267390294_1573462332709246,"Hey everyone, I wanted to see if I can ask for a favor. I need to find good resources on virtual memory/virtual machine security/protection. If anyone know any good links, articles, videos it would help me a lot. thank you.",Tanner Summers,,status,,2017-04-15 20:52:45,0,1,0,0,0,0,0,0,0
759985267390294_1572330152822464,Tips for a software development interview? 👍,Raymond Lee,,status,,2017-04-14 22:12:01,1,10,0,1,0,0,0,0,0
759985267390294_1573470019375144,fontawesome.io has the Pied Piper icons haha,Alvin Lin,,photo,https://www.facebook.com/photo.php?fbid=1313178855418213&set=gm.1573470019375144&type=3,2017-04-15 21:03:38,28,3,0,25,0,0,3,0,0
759985267390294_1573380009384145,"Any IOS developers that is familiar with WatchConnectivity can tell me what this error means? 

[WC] -[WCSession _onqueue_notifyOfMessageError:messageID:withErrorHandler:] 62AEA538-8E8A-446A-B4E3-65BB07315EBB errorHandler: NO with WCErrorCodeTransferTimedOut->IDSErrorTypeTimedOut->IDSResponseTimedOut

More context here : ",Dre Campbell,WatchConnectivity timeout error between iphone and apple watch,link,http://stackoverflow.com/questions/43420801/watchconnectivity-timeout-error-between-iphone-and-apple-watch,2017-04-15 19:05:13,0,0,0,0,0,0,0,0,0
759985267390294_1573356829386463,Are you in #Colombia? #Y4PThackathon,Seb Per,Youth For Public Transport (Y4PT),link,http://www.y4pt.org/projects/hackathon/,2017-04-15 18:35:26,1,0,0,1,0,0,0,0,0
759985267390294_1572346039487542,Interesting...,Ishan Goel,,photo,https://www.facebook.com/photo.php?fbid=1486763644727680&set=gm.1572346039487542&type=3,2017-04-14 22:38:28,86,8,0,66,0,7,10,3,0
759985267390294_1570054056383407,.,Parham PD,Just Andrew,video,https://www.facebook.com/JustAndrewX/videos/949193361851023/,2017-04-13 01:45:15,272,20,47,189,14,0,69,0,0
759985267390294_1573261169396029,Hey Everyone! Check out MVHacks coming this summer! For all new and experienced programmers. Sign up now at ,Paran Sonthalia,MVHacks - Bay Area Summer Hackathon,link,http://mv-hacks.com/,2017-04-15 16:38:19,0,0,0,0,0,0,0,0,0
759985267390294_1572957962759683,https://www-bbc-co-uk.cdn.ampproject.org/c/www.bbc.co.uk/news/amp/39533308,Natu Myers,Artificial intelligence: How to avoid racist algorithms - BBC News,link,https://www-bbc-co-uk.cdn.ampproject.org/c/www.bbc.co.uk/news/amp/39533308,2017-04-15 10:37:54,51,2,4,45,4,0,1,1,0
759985267390294_1572693052786174,"[Fixed] Enter : ""close_windows_when_empty"": false into User Settings.

So, I'm trying to launch Sublime Text 3 on my Sierra macbook right now and everytime i do, it shows the text window for a fraction of a second and then disappears. To show it, I have to click the icon every time and it's really annoying. Any idea what's going on? I don't have this behaviour on my hackintosh though

Further testing revealed that it happens on an on and off basis. I launch the app once, it doesn't show a window. I open the app again, it does show a window. and rinse and repeat",Ramy Nabil,,status,,2017-04-15 06:09:50,0,3,0,0,0,0,0,0,0
759985267390294_1573180279404118,"HackUMBC is excited to announce the registration for its Innovate Good hackathon is live! Innovate Good will be a 24-hour event with the theme of creating software or hardware projects to benefit social causes. We have 4 main tracks we will be awarding prizes for:
- Health Environmental
- Legal/Justice
- Housing
- Education
In addition to these tracks, we will also have sponsor prizes as usual! Please register early as we will only be accepting a limited number of attendees.

",Jaime Orellana,Innovate Good,link,https://innovate.hackumbc.org/,2017-04-15 14:47:31,5,2,1,5,0,0,0,0,0
759985267390294_1570886242966855,"Apparently these hackers have taken over many popular youtube videos. Youtube search: ""#OurMine https://youtu.be/IdJuVgR_-7M"" and you can see all the videos they hacked.
Anyone know more about this?",Luc Olsthoorn,,photo,https://www.facebook.com/photo.php?fbid=826386374182171&set=gm.1570886242966855&type=3,2017-04-13 19:13:48,9,4,0,9,0,0,0,0,0
759985267390294_1573139009408245,"For those who have learned some python and want to get better, more ""idiomatic,"" I wrote a little article on fully leveraging sets into your coding workflow, I hope you like it: ",Roy Zheng,The Joy of Pythonic Sets,link,http://wontonst.blogspot.com/2017/04/the-joy-of-pythonic-sets.html,2017-04-15 14:03:48,4,0,0,4,0,0,0,0,0
759985267390294_1558090857579727,"http://stackoverflow.com/questions/43176251/node-js-passport-google-oauth-not-authenticating
I posted this question on Stack Overflow, but I'm not getting any answers :( I was wondering if anyone here could help.

Basically, I'm having trouble authenticating after redirecting to /auth/google/callback?code=<whatever>#. Passport would not authenticate this, and I cannot figure out how to solve this problem.

Thank you so much in advance!",Edward Joon-Hyuk Chang,Node JS Passport Google OAuth Not Authenticating,link,http://stackoverflow.com/questions/43176251/node-js-passport-google-oauth-not-authenticating,2017-04-03 10:27:33,5,5,0,4,0,0,0,1,0
759985267390294_1573121289410017,https://www.facebook.com/IO2017/posts/372891663105032,Patel Pranay,I/O Event,link,http://play.google.com/store/apps/details?id=com.deargeek.googleio17,2017-04-15 13:47:35,3,0,0,3,0,0,0,0,0
759985267390294_1573059356082877,"Blockchain hackathon next weekend in Toronto ; 

",Philippe Castonguay,Blockchain hackathon in Toronto with Vitalik Buterin,link,http://bglhackathon.com/,2017-04-15 12:36:42,1,0,0,1,0,0,0,0,0
759985267390294_1573041606084652,"Cool ad in France, but not sure if reactions are fake or not.

Quick translation ; 

People cross the street, a fake sound of car breaking goes on, people freak out, picture is taken and picture is put on a billboard with the message ; ""Don't take the risk of facing death"". 

https://www.facebook.com/danstapub/videos/910982162397585/",Philippe Castonguay,Dans Ta Pub,video,https://www.facebook.com/danstapub/videos/910982162397585/,2017-04-15 12:15:27,12,0,0,9,0,3,0,0,0
759985267390294_1567335713321908,"I know this may be more of a marketing type question, but there are a lot of web devs here trust may be able to give me advice. I just launched a new website and although I've went through SEO and keyword choice, popular search terms, etc. I seem to continue having trouble getting traffic. I have $100 google ad credit though it's probably not smart to promote a site that's just starting and doesn't have much to it.

I should mention it's a blog and talks about projects (currently only one) and some background/concepts surrounding said projects. Other than trying to ""market"" myself in appropriate forums/communities what do you all recommend?

Greatly Appreciated :)",Marcello Barbieri,,status,,2017-04-10 19:17:54,2,1,0,2,0,0,0,0,0
759985267390294_1572796922775787,"Hi Hackathon HACKERS! I have a friend at Oxford doing PhD in Politics, suddenly found himself loving coding and want some further study this summer in London! Anybody knows any great coding camp in London to study web full-stack coding? Good to have a great environment where he can find nice peers to code together!",Zhang Jian Nan,,status,,2017-04-15 08:25:30,4,4,0,4,0,0,0,0,0
759985267390294_1572832362772243,Part 11 of my tutorial. I setup the facebook auth flow in the server and make it ready to work with the mobile auth. Hope you enjoy :),Emanuel Quimper,React-Native & Node Tutorial - Build a Meetup app [Part: 11],video,https://www.youtube.com/attribution_link?a=SKoJZ7hs5LI&u=%2Fwatch%3Fv%3DKZWLd7OwQF8%26feature%3Dshare,2017-04-15 08:58:39,6,0,0,6,0,0,0,0,0
759985267390294_1572806526108160,Is anyone attending Portland State University right now? Or knows anyone who are leasing their dorms for the summer? Please pm!,Joan Tubungbanua,,status,,2017-04-15 08:35:01,2,0,0,2,0,0,0,0,0
759985267390294_1570849472970532,"print(""Hello, HH! I made a comic.¯\_(ツ)_/¯"")
---
http://www.webtoons.com/en/challenge/otter-this-world/list?title_no=74462
Become a patron! https://www.patreon.com/reikacanja",Rei Kacanja,,photo,https://www.facebook.com/photo.php?fbid=643629095837325&set=gm.1570849472970532&type=3,2017-04-13 18:19:47,257,5,0,195,4,0,58,0,0
759985267390294_1572002116188601,"Hey everyone... We are trying a sort of social experiment just to see what kind of stuff people will say when no one knows they are saying it.
We are live streaming an amazon Alexa that will say what ever you tell it to say on this link: https://speak.ngrok.io
Curious to see what happens!",Waseem Shabout,speak.ngrok.io,link,https://speak.ngrok.io/,2017-04-14 15:19:17,5,2,1,5,0,0,0,0,0
759985267390294_1572623162793163,https://www.codechef.com/snackdown/2017?REF=ashsin108,Ashish Sinha,Home page | CodeChef,link,https://www.codechef.com/snackdown/2017?REF=ashsin108,2017-04-15 04:17:45,0,0,0,0,0,0,0,0,0
759985267390294_1571974266191386,If someone understands Formal Languages and can tutor me I will pay lol...my teacher is so bad with her lectures I'm completely lost with this hw...,Luis Villavicencio,,status,,2017-04-14 14:44:26,1,5,0,1,0,0,0,0,0
759985267390294_1572039462851533,"Hey guys.
Does anyone know any service similar to Pushbullet Mirror Notification? The only difference from their service is that I want to send the notifications data to a webserver, not to my PC.

Thank you!",Mihai Costi,,status,,2017-04-14 16:04:39,0,3,0,0,0,0,0,0,0
759985267390294_1557503067638506,"What are salaries like in Los Angeles for (entry-level) software engineers? I've been poking around on Glassdoor but it's not really consistent with what Indeed says about LA salaries

(I'm a backend guy if it matters at all)",Ian Mobbs,,status,,2017-04-02 21:52:43,1,3,0,1,0,0,0,0,0
759985267390294_1570374806351332,,Souleymane Diaouné,Hacker News,link,https://techcrunch.com/2017/04/12/hell-o-uber/,2017-04-13 09:21:20,55,4,5,34,0,11,8,1,1
759985267390294_1572229386165874,"For the past 3 weeks this one fucking feature has been pissing on me. Bug after bug after bug after bug.

But fear not my brothers and sisters! I HAVE VANQUISHED SAID FEATURE. 
No longer will it's problems keep me up at night.
No longer will it's console.log()s plague me with nightmares.
NO LONGER WILL I FEEL INADEQUATE!

""You will find peace not by trying to escape your problems, but by confronting them courageously. You will find peace not in denial, but in victory."" - J. Donald Walters

And how true this quote is because today, I am able to go back home and finally be at peace

...until Monday when I have to deal with deploying this beast of programming hell.

Good night.",Hamza Khan,,status,,2017-04-14 20:14:41,2,3,0,2,0,0,0,0,0
759985267390294_1572423159479830,"LAST REMINDERS for applying to international hackathon Junction Tokyo 2017! The teams will be hacking among others the future of human and robot co-creation with SoftBank and Pepper robots, and sustainable consumption with DMM.com. Check the event  – less than ONE WEEK left to apply!",Niklas Karvonen,Junction Tokyo 2017,event,https://www.facebook.com/events/716717601823855/,2017-04-15 00:08:56,2,0,0,2,0,0,0,0,0
759985267390294_1571961909525955,"We redesigned the MLH Season Events listing page - what do you think of the Beta?

",Jonathan Gottfried,The Official 2017 Season North America Hackathon Schedule,link,https://mlh.io/beta/events/on,2017-04-14 14:29:43,39,8,0,30,6,2,0,0,1
759985267390294_1572331316155681,"Hey everyone, hope everyone's having a great Long weekend! ... I'm going to spend it finding a few more Coding wizards! ... If you are or know someone who's excellent in C++ , Java, or .Net, please message me. Thanks!",Daniel Lim,,status,,2017-04-14 22:13:35,1,2,0,1,0,0,0,0,0
759985267390294_1572364539485692,"I tried to apply for cuny tech prep, is signing up all you do and that counts as an application for the program ?
thanks",Nayem Lb,,status,,2017-04-14 22:57:43,0,0,0,0,0,0,0,0,0
759985267390294_1570970262958453,What's the most obscure hardware you've seen hacked?,Robert Rose,,status,,2017-04-13 20:45:33,0,7,0,0,0,0,0,0,0
759985267390294_1571092402946239,"iojs vs nodejs?  What is best for online multiplayer games?  I'm new to this and looking to learn, but would like some input on what is better.",Todor Gishin,,status,,2017-04-13 23:06:56,2,3,0,2,0,0,0,0,0
759985267390294_1572357459486400,"If you are between the ages of 13 to 19 and would like to participate in Teen Hackathon during the summer months, please email Rauhmel@WHOmentors.com

Be sure to indicate which school you attend, what type of laptop you use, identify the type of mobile device you use, and indicate when your school will let out for the summer. For example, the last day of school for San Francisco Unified School District (SFUSD) is Friday, May 26, 2017.

https://www.youtube.com/watch?v=son5gcDHo0I

NOTE: No coding experience required. In contrast to other summer camps, you will ""train backwards"" from re-skinning working apps to understanding complete theory. Therefore, you are expected to have more than one application created.",Rauhmel Fox,Wake Up! Join Teen Hackathon (teenhackathon.com),video,https://www.youtube.com/watch?v=son5gcDHo0I,2017-04-14 22:49:11,2,0,0,1,1,0,0,0,0
759985267390294_1572273482828131,"Let's use a Variational Autoencoder to generate images! This generative model fascinates me, especially the reparameterization trick that lets us backpropagate despite it having stochastic nodes. ",Siraj Raval,How to Generate Images - Intro to Deep Learning #14,video,https://www.youtube.com/watch?v=3-UDwk1U77s,2017-04-14 21:09:26,6,0,0,6,0,0,0,0,0
759985267390294_1570698056319007,"Apart from .com and .io domains, which other domain extensions are great?",Hype Emmanuel Mcee,,status,,2017-04-13 15:15:11,3,27,0,3,0,0,0,0,0
759985267390294_1572207666168046,"Apple Pay Now Supports Instant Donations to Nonprofits! 

https://www.apple.com/newsroom/2016/11/a-touch-of-giving-with-apple-pay.html

In response, I'm planning a miniature Community Service Hackathon for about 30 volunteers to create iOS mobile applications (including games) and websites integrated with Apple Pay for Donations.

If you'd like to be invited, please email rauhmel@whomentors.com

Be sure to indicate if you can be available to attend a single event on May 23, 2017 from 8AM to 6PM.  You can suggest another weekday if this one doesn't work for you.

The location will be Capital One Café on 101 Post Street and Kearny in San Francisco, California.

NOTE: Swift 3 (Xcode 8.3.1) and/or Javascript will be used.  No experience necessary.

SMS text 415-373-6767 with any specific questions.",Rauhmel Fox,,photo,https://www.facebook.com/photo.php?fbid=1456020861116881&set=gm.1572207666168046&type=3,2017-04-14 19:36:37,7,1,0,7,0,0,0,0,0
759985267390294_1572194786169334,Thoughts? ,An-Hoà Nguyễn,Electron is flash for the desktop,link,https://josephg.com/blog/electron-is-flash-for-the-desktop/,2017-04-14 19:21:13,6,0,0,6,0,0,0,0,0
759985267390294_1571037112951768,Any cool ideas for summer side projects during an internship?,Harry Chen,,status,,2017-04-13 21:47:39,18,10,1,18,0,0,0,0,0
759985267390294_1572088646179948,"How can I add an image where the user clicked. In other words, if I click somewhere within the body it should add a small image on the place I clicked. Can someone help? (Javascript)",Yusuf Bagha,,status,,2017-04-14 17:04:51,1,2,0,1,0,0,0,0,0
759985267390294_1572099082845571,"Jeff Atwood is looking to hire a Ruby/Rails Dev to test discourse. Could be a nice summer Internship project. 🤓🤔
",Nyah Watad Check,Jeff Atwood on Twitter,link,https://twitter.com/codinghorror/status/852996686083379200,2017-04-14 17:17:16,1,0,0,1,0,0,0,0,0
759985267390294_1571979532857526,"Hey guys! I've finally finished my first bigger project so i want to share it with you. It's iOS app I've made from scratch, designed for pet owners :) If you have an iPhone i would love to hear some feedback from you, and generally some tips about marketing/promoting it to the world! :)

https://www.facebook.com/petdayapp

And I've also got the website (landing page) http://petdayapp.com/",Никола Милић,Pet Day,link,https://www.facebook.com/petdayapp/,2017-04-14 14:49:44,3,1,0,3,0,0,0,0,0
759985267390294_1570681722987307,"(off-topic) HELP PLEASE
How to print white on a white A4?
I want to have a white A4 page turnt into full black with a printer but leaving the places out where the text is so you effectively get white text. Can Someone help me ASAP. I can't find it on the googlez already tried. :(",Rowen Hendrikson,,status,,2017-04-13 14:48:04,2,6,0,0,0,0,2,0,0
759985267390294_1572041156184697,"I know that apps published in Apple App store must use Apple's in-app processor. How about Google Play Store?

What if I want to implement my own stripe payment interface? is that allowed?

Everything i'm reading in this page seems to suggest I am, but still dunno.",Joram Clervius,Google Play,link,https://play.google.com/about/developer-distribution-agreement.html,2017-04-14 16:07:55,0,0,0,0,0,0,0,0,0
759985267390294_1571675129554633,Looking for some free good software to run on my mac but has too recover lost files due to reinstall/format on windows partion its only about 3 gb of photos!!!! Any thing would help. Thanks,Joel R Guilbeau,,status,,2017-04-14 10:30:43,0,1,0,0,0,0,0,0,0
759985267390294_1568920836496729,,Rohit Bhatia,Google now lets you submit URLs for indexing straight from Search,link,https://thenextweb.com/google/2017/04/10/google-index-url-submission-search/?utm_content=buffer75c39&utm_medium=social&utm_source=facebook.com&utm_campaign=buffer#.tnw_5NAtoHD2,2017-04-12 03:17:22,196,6,11,176,1,19,0,0,0
759985267390294_1571966172858862,,Ravi Vadrevu,,status,,2017-04-14 14:35:18,1,0,0,1,0,0,0,0,0
759985267390294_1571955639526582,"So the NSA tools released by Shadow Brokers on Friday are available here (decrypted) for anyone to look at https://github.com/x0rz/EQGRP_Lost_in_Translation

I thought I should share because it took me some time to find this link. :)

If you want to follow the developments around this leak you should follow @hackerfantastic https://twitter.com/hackerfantastic",Muhammad Yasoob Ullah Khalid,x0rz/EQGRP_Lost_in_Translation,link,https://github.com/x0rz/EQGRP_Lost_in_Translation,2017-04-14 14:23:59,1,0,0,1,0,0,0,0,0
759985267390294_1570697526319060,"Apart from .com and .io domains, which other domain extensions are great?",Hype Emmanuel Mcee,,status,,2017-04-13 15:14:13,1,8,0,1,0,0,0,0,0
759985267390294_1571884332867046,"Here's another product of QuickDraw data: doodles! These doodles are very cute and we should be afraid lol

",Evan Bindz,Google's AI has learned how to draw by looking at your doodles,link,http://www.theverge.com/2017/4/13/15284448/google-ai-draw-doodles-sketch-rnn,2017-04-14 13:16:10,15,0,4,14,1,0,0,0,0
759985267390294_1570533356335477,"Just put together, with Lenny Khazan, what we think is one of the most comprehensive yet simple/fun tutorial on recurrent neural networks/LSTMs on the Internet:

",Rohan Kapur,Rohan & Lenny #3: Recurrent Neural Networks – A Year of Artificial Intelligence,link,https://ayearofai.com/rohan-lenny-3-recurrent-neural-networks-10300100899b,2017-04-13 12:01:31,22,2,4,19,3,0,0,0,0
759985267390294_1570656776323135,Hustlin' like a pro.,Sadok Cerv Rabadan,,status,,2017-04-13 14:11:10,106,5,0,85,3,2,16,0,0
759985267390294_1570674572988022,Anyone follow the 2+2 program for Penn state for CE (Erie -> UP in particular)? have a few questions on courses and all,Ali Malik,,status,,2017-04-13 14:36:54,0,2,0,0,0,0,0,0,0
759985267390294_1571072659614880,"Just set up my new Raspberry Pi. What packages do you recommend I install (mostly python and website work)?
Edit: I am using Rapsbian (Debian)",Saksham Badyal,,status,,2017-04-13 22:34:54,1,3,0,1,0,0,0,0,0
759985267390294_1570270036361809,"Hey guys! I have recently taken my first crack at a blog post and I was wondering if I could get some feedback on both my view and my writing. Sorry if this is the wrong place to post.
",Charlie Thomas,Charles Attwood Thomas | Developer,link,http://attwoodthomas.me/blog/view/3,2017-04-13 07:13:37,1,3,0,1,0,0,0,0,0
759985267390294_1527022460686567,"I need to install an operating system on my server, but my server 1and1 said I can't do that on shared hosting. How can I get around this and do it on shared hosting? What we want is to be able to have a computer that is accessible through a browser on a url. Therefore, the computer is usable through any device with an internet connection.",Joe McDonald,,status,,2017-03-07 20:12:54,0,23,0,0,0,0,0,0,0
