status_id,status_message,status_author,link_name,status_type,status_link,status_published,num_reactions,num_comments,num_shares,num_likes,num_loves,num_wows,num_hahas,num_sads,num_angrys
759985267390294_1576528442402635,"For those wanting to work with big data, Reddit released a dataset of all tile placements on /r/Place, with plenty of examples.",Max Woolf,Place Datasets (April Fools 2017) • r/redditdata,link,https://www.reddit.com/r/redditdata/comments/6640ru/place_datasets_april_fools_2017/,2017-04-18 13:05:45,0,0,0,0,0,0,0,0,0
759985267390294_1576518979070248,"Hello everyone!
I'm working towards a website which will need authentication and at one point will also become an app, I want to avoid using OAuth (using Gmail, Facebook, etc.). I'm looking for any advice on how to get started and which framework would best cater to my needs?",Ayushya Amitabh,,status,,2017-04-18 12:54:31,1,0,0,1,0,0,0,0,0
759985267390294_1575903159131830,"If you live, breathe and sleep AI, you should sign up to volunteer at Global AI Hackathon in San Francisco.

jk, anyone can sign up. <3

http://ai.hackathon.com/",Prashish Rajbhandari,Global AI Hackathon - San Francisco - Volunteer Sign-Up,link,https://docs.google.com/forms/d/1J2ZhUoFXmXE2_t3cORlwaiCKZVPV1Ix_dXsd21t9TqU/edit?c=0&w=1#responses,2017-04-18 00:46:44,3,2,0,3,0,0,0,0,0
759985267390294_1575648559157290,"Hey everyone,
I'm somewhat new (<1 year) to programming and I'm trying to transition from engineering (my job now) into web app dev / ux possibly. I've gone through basic/intermediate HTML/CSS and right now I'm working myself through JS. 

Does anyone have any advice/book recs/resource recs they'd be willing to throw my way? You're all awesome. Thanks!",Natalie Tham,,status,,2017-04-17 18:56:31,10,24,3,10,0,0,0,0,0
759985267390294_1576145899107556,What do y'all think of this?🤔 There have been lots of talks of governments introducing a basic income due to the fact that robots will automate jobs. Looks like we'll need that basic income soon depending on what professions get automated in the near future.,Neil Patel,CNN,video,https://www.facebook.com/cnn/videos/10156467948131509/,2017-04-18 06:33:47,14,10,2,14,0,0,0,0,0
759985267390294_1576060189116127,"after 39-40 hours, i finally solved the bug lol 

(look at the commit messages)",Shashwat Shagun,,photo,https://www.facebook.com/photo.php?fbid=388733911526120&set=gm.1576060189116127&type=3,2017-04-18 04:25:19,51,12,0,34,0,0,17,0,0
759985267390294_1576454232410056,"Hi guys can you send me names of laptops that are the best for programming, within the price range of $500-$600? Thank you fellow Hackers.",Jules Wright,,status,,2017-04-18 11:48:20,0,3,0,0,0,0,0,0,0
759985267390294_1576484285740384,"Hey all, if you or a friend gets good news from YC today, let me know and I can help with a practice interview :)",Max Kolysh,,status,,2017-04-18 12:21:48,4,0,0,3,1,0,0,0,0
759985267390294_1575777652477714,Has anyone done free code camp to augment their schooling? If so how did you like it and was it helpful?,Grant Simpson,,status,,2017-04-17 21:52:34,3,1,0,3,0,0,0,0,0
759985267390294_1575517755837037,As seen on HackerNews.,Armand Michael,nvbn/thefuck,link,https://github.com/nvbn/thefuck,2017-04-17 15:19:02,32,3,2,29,0,0,3,0,0
759985267390294_1576441552411324,"oh, you're still using yarn? heh, no...no...its fine.

",Michael Pinter,Why should we use pnpm? · Zoltan Kochan,link,https://www.kochan.io/nodejs/why-should-we-use-pnpm.html,2017-04-18 11:32:32,1,0,0,1,0,0,0,0,0
759985267390294_1576428652412614,"Hi everyone! Made a silly app.

Punch ur friend on iMessage & see who has the stronger punch. 

",Cezar Babin,PunchForPunch - Product Hunt,link,https://www.producthunt.com/posts/punchforpunch,2017-04-18 11:20:37,0,1,0,0,0,0,0,0,0
759985267390294_1575607512494728,New Hackathon coming up in June! IBM Hacking in NYC at Galvanize! https://www.eventbrite.com/e/mobilemonday-api-first-hackathon-nyc-tickets-33320669018,Gabriel Ortiz,,photo,https://www.facebook.com/photo.php?fbid=10156031395889746&set=gm.1575607512494728&type=3,2017-04-17 17:44:01,24,7,0,21,2,1,0,0,0
759985267390294_1575939762461503,"[Serious]
I am taking Artificial Intelligence course in my University. Are there any cool ideas we can develop based on regression analyses?
thanks",Saif Rahman,,status,,2017-04-18 01:26:56,1,2,0,1,0,0,0,0,0
759985267390294_1574516495937163,"I made an app that matches comments on adult videos to inspirational wallpapers, with pretty hilarious results. 

Tons of work to do to make it more functional, but it was some decent practice on web scraping. 

If you want to download/star for a cheap laugh: 
https://github.com/tonydelanuez/Juxtaposition-Generator

Built with Python, Node, and Express. 

Hosted it on Heroku but with the way I had it setup doesn't allow for ""random"" generation (can't write to Heroku filesystem and I use CSV)",Tony De La Nuez,,status,,2017-04-16 18:13:21,50,6,0,40,0,0,10,0,0
759985267390294_1575575379164608,"One of the most popular ""programming"" quotes floating around the internet (my fav if I may add) is by John Johnson ""First, solve the problem. Then, write the code."" Now I have been trying to look up who he is but can't find him. Can anybody point me to where I can know more about him?? Thank you!",Joshua Abu,,status,,2017-04-17 16:57:25,3,2,0,3,0,0,0,0,0
759985267390294_1575958095793003,Hi everyone! Can anyone help me to convert my shell script into a Rest api? I want to run the script via url and pass parameters to it :),Rahul Agarwal,,status,,2017-04-18 02:05:54,0,5,0,0,0,0,0,0,0
759985267390294_1575811895807623,"New video out! 

Disclaimer: FOR SANITY'S SAKE USE NGINX OR CADDY. But if ur hate urself. Here's some instructions to set up Apache. 😜

https://www.facebook.com/TheAmyCode/photos/a.1838632056354433.1073741828.1827214117496227/1853823878168584/?type=3&theater",Amy Chen,Amy Codes,photo,https://www.facebook.com/TheAmyCode/photos/a.1838632056354433.1073741828.1827214117496227/1853823878168584/?type=3,2017-04-17 22:41:47,22,3,0,22,0,0,0,0,0
759985267390294_1576264379095708,"Anyone on Udacity? which project are you currently on?

Hypemanu-> Android development.
I will be filling my Github account with the lessons learnt per session.",Hype Emmanuel Mcee,,status,,2017-04-18 08:31:20,0,0,0,0,0,0,0,0,0
759985267390294_1576017402453739,"""Getting into tech"" doesn't necessarily mean you're just in it for the money. Thoughts?
",Daniel Hsing,"Tech is the worst field to just ""get into""",video,https://www.youtube.com/watch?v=hYF-R9IsPyM,2017-04-18 03:16:17,1,2,0,1,0,0,0,0,0
759985267390294_1575375109184635,I fucked up massively over the weekend... heres what happened.,Jay Zalowitz,"A Note on Losing 89,000 Readers in 33 Hours – Hacker Noon",link,https://hackernoon.com/a-note-on-losing-89-000-readers-in-33-hours-423861897748,2017-04-17 12:29:00,18,3,2,12,0,1,0,4,1
759985267390294_1575203999201746,"I'm on the lookout for a gently used MacBook Pro with similar specs to what I have listed here. 

Willing to discuss most reasonable offers, preferably within the USA.

Please comment here if you've got one laying around your office/room and I'll PM you to start a discussion.",Oli Treadwell,,photo,https://www.facebook.com/photo.php?fbid=10155242823811468&set=gm.1575203999201746&type=3,2017-04-17 09:22:07,6,3,0,6,0,0,0,0,0
759985267390294_1575338642521615,"Brilliant opportunity for all the deep learning and AI folks over here. Deep Learning Camp Jeju 2017 is a fully funded month-long program in Jeju Islands, South Korea, where participants gain hands-on experience with TensorFlow through individual-based proposed projects. Via Flow | Empowering Students",Harshit Jaiswal,"Machine Learning Camp Jeju, South Korea - 2017 (Fully Funded) | Flow",link,http://bit.ly/2on18xZ,2017-04-17 11:57:20,14,1,3,13,1,0,0,0,0
759985267390294_1576157112439768,"Hey HH! I'm looking for some feedback for something I'm working on. This is for all the people that have ever needed a logo for their service, product or something else.

Please view the current landing page to get an idea of how it will work when the software is done, and/or read below. https://logodrops.com/

I'm working on an online logo maker where you can get a logo made in just a couple minutes. Select a style, choose your colors, describe what your business is about or does and *poof*, you get 20 logos delivered to your screen in seconds.
You then get the option to generate more logos, or.. select a logo and modify the font, colors, symbol or layout. Simple, yet professional looking logos. No templates but a mix of symbols, shapes, monograms and fonts.

Once you're happy with the result you can purchase all the source files (vector/svg) plus other assets such as a reversed colored version, templates for business cards or for your social media pages.

Any suggestions for the LP or how the software will work?
Maybe something you're looking for in a logo?
Would you or how much would you pay for a logo with a free/premium font including nicely placed symbols/shapes?",Giliam Verheide,Online logo maker: Design your own logo in 3 simple steps,link,https://logodrops.com/,2017-04-18 06:45:27,0,0,1,0,0,0,0,0,0
759985267390294_1560213570700789,"*Please note* : bofrost* hackathon postponed !! NEW DATE: 09.-11.06.2017

_

Hey there!
Who´s in for a Food/Delivery hackathon? We are looking for creative startups, students, developer, designer and biz people and would like to invite you to the Bofrost hackathon in Cologne!! 
For more information and free tickets, this way please ;)

http://hack.institute/events/bofrost-hackathon/

Best,
Nadja from hack.institute",Nadja Eminoğlu-Leuci,bofrost* Hackathon am 09.-11.06. in Köln,link,http://hack.institute/events/bofrost-hackathon/,2017-04-05 06:28:30,4,2,0,4,0,0,0,0,0
759985267390294_1573233566065456,"damn it guys, react or angular? I just can't decide.",Steven  Shang,,status,,2017-04-15 15:52:02,28,75,0,22,0,0,6,0,0
759985267390294_1575982439123902,Hi guys! Is there anyone from Khan Academy in this group? Or do you know of someone who works over there? It would be awesome if you can put me in touch :),Muhammad Yasoob Ullah Khalid,,status,,2017-04-18 02:31:01,1,0,0,1,0,0,0,0,0
759985267390294_1575970245791788,,Deepak S Devu,Codeground,photo,https://www.facebook.com/codeGroundOnlineTest/photos/a.1525866594392121.1073741828.1514950148817099/1753103005001811/?type=3,2017-04-18 02:16:14,0,0,0,0,0,0,0,0,0
759985267390294_1573979072657572,https://www.xudongz.com/blog/2017/idn-phishing/,Manan Singh,Phishing with Unicode Domains - Xudong Zheng,link,https://www.xudongz.com/blog/2017/idn-phishing/,2017-04-16 07:55:52,107,6,5,73,2,30,1,1,0
759985267390294_1575738122481667,"Hi fellow Hackathon Hackers! :)

Does someone know the best way to contact Jay Freeman (Cydia)? This is regarding a hackathon.

Thanks :)",Dhanush Patel,,status,,2017-04-17 21:02:30,5,5,0,5,0,0,0,0,0
759985267390294_1574013595987453,[serious] Why is this group so interested in startups and entrepreneurship?,DeAndre Washington,,status,,2017-04-16 08:50:13,64,37,0,50,2,0,11,1,0
759985267390294_1574606185928194,Pipey – Silicon Valley,James Biswas,Pipey – Silicon Valley,link,https://chrome.google.com/webstore/detail/pipey-%E2%80%93-silicon-valley/lflfcoohcjnefmkolcdalkiiallgabon?utm_source=chrome-ntp-icon,2017-04-16 20:16:30,41,5,0,34,1,0,6,0,0
759985267390294_1573987869323359,"Hey everyone, so I'm working on my personal webserver tonight. I've installed EHCP (Easy Hosting Control Panel) onto a Ubuntu-based webserver before with no problems. 

I'm using Windows 8.1, and PuTTY as my console. I run a droplet off of DigitalOcean. 

However, when I use the steps provided in 

http://www.servermom.org/ehcp-installation-guide-on-ubuntu-14-04-vps/

I get stuck at this: (points to attached screenshot)

Does anyone know where I went wrong, or if I did at all? I have a guess that because EHCP is older, it's install script may reference a version of PHP that is not actively being maintained by apt-get anymore? 

I appreciate any help I can get on this, thx :D",Jesse Hayward,,photo,https://www.facebook.com/photo.php?fbid=10158512226960463&set=gm.1573987869323359&type=3,2017-04-16 08:11:26,1,7,0,1,0,0,0,0,0
759985267390294_1575183142537165,0:43 >start counterstrike lol,Luong Vo,The Most Accurate Hacking Scene Ever,video,https://www.youtube.com/watch?v=K7Hn1rPQouU,2017-04-17 09:08:16,31,5,0,21,0,1,9,0,0
759985267390294_1575768325811980,"Have you taken the time to 'like' us? Take a fraction of a second to like our page! We engage in the betterment of the Monterey County, California by teaching computer science and heighten community problem-solving, like herScript Hacks 2017 and HerScript Presents, Hack Your Curiosity Part 4: MOBILE APP DEVELOPMENT

Thank you for your support <3",Anita Garcia,herScript,link,https://www.facebook.com/herScriptCS/,2017-04-17 21:36:15,2,0,0,1,1,0,0,0,0
759985267390294_1575238222531657,"Hi all,

Im a Duke ECE/CS student looking for a summer SWE internship and was wondering if HH has any resources to help?
Maybe a list of startups looking for interns or a location to post github/likedin/resume?

Thanks",Jeremy S Morgan,,status,,2017-04-17 10:05:36,17,6,0,13,1,0,0,3,0
759985267390294_1575725175816295,,Jesica Quinones,HackUMass,photo,https://www.facebook.com/hackUMass/photos/a.266410723526015.1073741828.259740784193009/813553995478349/?type=3,2017-04-17 20:41:59,1,0,0,1,0,0,0,0,0
759985267390294_1574563122599167,"I've spent too much time on this... only got to be a unicorn twice D:
 ",Leanna Pancoast,Unicorn Startup Simulator by Toggl | Put your entreprenurial skills to the test,link,https://toggl.com/startup-simulator/,2017-04-16 19:20:24,82,9,6,65,2,1,14,0,0
759985267390294_1575643905824422,Does anyone have experience with Omeka. My team and I are currently stuck on a project and need some help.,Saurav Kharb,,status,,2017-04-17 18:44:35,1,0,0,1,0,0,0,0,0
759985267390294_1575640489158097,Finally!,Ash Pachelli,"Google, Huawei May Soon Face Class-Action Lawsuit Over Nexus 6P Early Shutdown, Bootloop Issues",link,http://www.techtimes.com/articles/205062/20170417/google-huawei-may-soon-face-class-action-lawsuit-over-nexus-6p-early-shutdown-bootloop-issues.htm,2017-04-17 18:37:28,2,0,0,2,0,0,0,0,0
759985267390294_1575622152493264,I'm writing a paper with my professor on restrictive covenants in the tech industry - anybody want to offer up any privacy policies they have that aren't under NDA?,Michael Gangnath,,status,,2017-04-17 18:11:21,2,0,0,2,0,0,0,0,0
759985267390294_1574355029286643,I'm starting college in September. I need a good computer for photo/video editing and coding software. What do people recommend?,Lucky Milo Whitburn-Thomas,,status,,2017-04-16 14:54:13,6,30,0,6,0,0,0,0,0
759985267390294_1575446075844205,,Victor,Five Things I've Learned As A New Manager At Google,link,https://www.fastcompany.com/40405205/five-things-ive-learned-as-a-new-manager-at-google,2017-04-17 13:50:22,13,1,1,13,0,0,0,0,0
759985267390294_1570951889626957,"What bug are y'all currently trying to fix?

I'm having this weird problem where the first element in my array is being skipped in a certain function.
Your turn.",Hamza Khan,,status,,2017-04-13 20:24:30,6,34,0,6,0,0,0,0,0
759985267390294_1575467672508712,"How Good Archiving Prevents Dark Ages
",Chris Parbey Jnr,How Good Archiving Prevents Dark Ages - Edgy Labs,link,https://edgylabs.com/2017/04/17/good-archiving-prevents-dark-ages/,2017-04-17 14:16:55,3,0,0,3,0,0,0,0,0
759985267390294_1575447712510708,Something that you may find informative/interesting.,Ankit Arya,Phishing with Unicode Domains - Xudong Zheng,link,https://www.xudongz.com/blog/2017/idn-phishing/,2017-04-17 13:53:30,1,0,0,1,0,0,0,0,0
759985267390294_1574291965959616,ReactJS vs. AngularJS vs ...? for Steven Shang,Hanns Chong,,status,,2017-04-16 13:45:21,3,9,0,3,0,0,0,0,0
759985267390294_1575380745850738,Anyone know why Docker Shipyards website is down?,Max Farrell,,status,,2017-04-17 12:36:25,0,0,0,0,0,0,0,0,0
759985267390294_1572132722842207,Anyone building an uber for homemade food? ,Dan Gailey,Tommy Wooley's post,link,https://baqqer.com/posts/2098,2017-04-14 18:07:48,8,17,0,7,1,0,0,0,0
759985267390294_1575333699188776,"Watch DockerCon17 live from your device
🐳🐳🐳",Iliad,Livestream – dockercon,link,http://2017.dockercon.com/livestream/,2017-04-17 11:53:01,0,0,0,0,0,0,0,0,0
759985267390294_1574330319289114,"[long post]
Hey hackathonees? well, i am on instagram [and it is immense]. so, i like finding new connections. but every time i click some profile, like [deuhacks, java_posts] i only can screenshot their profile to save their works. is there a way of creating data scrappers to store my instagram activity? we can name it instascrape.

EDIT: my instagram username is @hypemanu",Hype Emmanuel Mcee,,status,,2017-04-16 14:29:11,1,3,0,1,0,0,0,0,0
759985267390294_1574356049286541,https://competitiveprogrammers.blogspot.in/ Hope this will be useful :),Priyam Kakati,Competitive programming for beginners,link,https://competitiveprogrammers.blogspot.in/,2017-04-16 14:54:40,12,2,1,12,0,0,0,0,0
759985267390294_1575246552530824,Some fun morning reading: ,Amy Chen,Announcing Longhorn: open source project for microservices-based distributed block storage,link,http://rancher.com/microservices-block-storage/,2017-04-17 10:16:23,2,0,1,2,0,0,0,0,0
759985267390294_1575243492531130,Good Morning Hackers!! Is there anybody here who knows people at Spotify I could reach out to? Looking to try and get my music on some playlists....thanks!! https://open.spotify.com/album/3PL7Gt2p0w55TubmygQ9Qz,Eva Snyder,,status,,2017-04-17 10:12:43,7,0,0,5,2,0,0,0,0
759985267390294_1574952172560262,"Hi everyone!

I built this small React app to convert dec-hex-bin-oct just for fun. It's the first React app that I build without following any tutorial and it's far from being completed since I only worked on it a few hours this weekend. Please take a look and let me know any thoughts! :) ",Kervin Lenin Vasquez H,Document,link,http://kervin-num-converter.herokuapp.com/,2017-04-17 03:35:24,9,1,0,8,0,1,0,0,0
759985267390294_1575195145869298,"Howdy folks!

Looking forward to participating in this group.

My name is Oli Treadwell, I'm a Software Engineer & Educator. Currently, working with Galvanize in Austin Texas.",Oli Treadwell,,status,,2017-04-17 09:17:34,2,0,0,2,0,0,0,0,0
759985267390294_1574292969292849,Hey everyone I planning on buying a new Android phone. What would you guys recommend? Hopefully something in the $400 range.,Paul Weliczko,,status,,2017-04-16 13:46:40,4,16,0,4,0,0,0,0,0
759985267390294_1574258919296254,Something that I'm working on. It does not function yet but I wanted to get an idea of how all of you like the questions and so on.,Jacob Roscoe,Unicorn,link,http://jacobroscoe.com/unicorn/index.html,2017-04-16 13:03:15,2,1,0,2,0,0,0,0,0
759985267390294_1574752972580182,"GitHub Uses Broken Cryptography, But It Has a Plan
__________

""In February, Google shocked the cryptography community by effectively breaking the stalwart SHA-1 hashing algorithm, making hypothetical concerns about the security of SHA-1 concrete for the first time. 

While most folks have moved on from SHA-1 already, there's one place on the web that has the algorithm at its core: GitHub, the nerve centre of every open source project from bitcoin, to government-owned elections software, to the weekend projects of most DIY-minded developers.""

EDIT: See James Mishra 's link for a more detailed and nuanced discussion on the topic.  

",Philippe Castonguay,"GitHub Uses Broken Cryptography, But It Has a Plan",link,https://motherboard.vice.com/en_us/article/github-uses-broken-encryption-but-it-has-a-plan,2017-04-16 23:08:22,22,3,2,21,1,0,0,0,0
759985267390294_1574961149226031,EU funds new data accelerator to get startups tackling societal problems http://tcrn.ch/2oE4vUB  #innovation #H2020 #OpenData #hackathons,Mogens Henrik Sørensen,Europe funds another data accelerator to get startups tackling societal problems,link,http://tcrn.ch/2oE4vUB,2017-04-17 03:50:30,7,0,2,7,0,0,0,0,0
759985267390294_1574925345896278,,Kunal Jain,Analytics Vidhya,photo,https://www.facebook.com/AnalyticsVidhya/photos/a.457177331040819.1073741827.452065408218678/1294750777283466/?type=3,2017-04-17 02:36:46,1,0,0,1,0,0,0,0,0
759985267390294_1574882315900581,NativeScript Speech Recognition with Angular 4 ,Paul Halliday,NativeScript Speech Recognition with Angular 4,video,https://youtu.be/C5i_EYjfuTE,2017-04-17 01:39:05,3,0,0,3,0,0,0,0,0
759985267390294_1523606667694813,"Hey everyone! Just wanted to remind everyone that we all love memes. Honestly, we do. But they do fill up the group, so as per the Code of Conduct, we will remove any ""shitposting, bad programmer jokes, or memes.""

Thankfully, there are subgroups for all of your shitposts, jokes, and memes! Feel free to join HH Sensible Chuckle or another appropriate subgroup to post to your heart's content.

(this policy also applies to comments made on other members' posts)

Full list of subgroups is available here - https://github.com/HackathonHackers/groups",Tristan Wiley,,status,,2017-03-04 11:17:23,123,15,0,94,3,0,1,9,16
759985267390294_1574155225973290,"Does anyone have experience deploying a Django web-app to an Apache server? 

I've looked online and the documentation is minimal.",Thomas Ortiz,,status,,2017-04-16 11:19:27,5,6,0,5,0,0,0,0,0
759985267390294_1574817989240347,"hey guys! do register! it's a fun weekend challenge and with some real quick good money! (you could have a crazy fun weekend with it for sure.)

the only criteria is that you must know Japanese to register.

#coding #webstaff #hackerearth",Sanjana Mehta,Japan National Coding Contest,link,https://www.hackerearth.com/en-us/challenge/competitive/japan-national-coding-contest-1/,2017-04-17 00:30:38,11,1,0,8,0,0,0,3,0
759985267390294_1574531552602324,"has anyone here participated in google codeu (not summer of code)? I was invited to it and I couldn't find much info about it, so I would love to hear people's experiences, what projects they made, etc!!",Sanjana Natraj,,status,,2017-04-16 18:31:09,10,1,0,7,0,3,0,0,0
759985267390294_1574417339280412,"anyone here have any experience with trying to install gitlab-communityedition? mind boggling how overcomplicated its gotten, especially granted that its a pretty and convenient replacement for a 30 line shell script (https://gist.github.com/alexanderankin/f7990e96ccd09e040a03d702f26f7661), with this, I dont have to worry about conflicting ports for ssh servers, or setting up reverse proxies, or load balancing, or external urls, or lets-encrypt integration (because they have their own tools for that), or any of the rest of it... It sort of makes me worried about the direction of some open source projects when they take a dive into dev-ops-istan, am i the only one?",David Ankin,,status,,2017-04-16 16:23:52,3,1,0,3,0,0,0,0,0
759985267390294_1571934239528722,"New youtube Layout & ""Dark Mode""

Put this into your console on youtube.com,
Refresh, then click on your profile photo
var cookieDate = new Date();
cookieDate.setFullYear(cookieDate.getFullYear( ) + 1);
document.cookie=""VISITOR_INFO1_LIVE=fPQ4jCL6EiE; expires="" + cookieDate.toGMTString( ) + ""; path=/"";",Iliad,YouTube has a secret 'Dark Mode' – this is how you activate it,link,https://thenextweb.com/google/2017/04/14/youtube-secret-dark-mode-activate,2017-04-14 14:04:05,48,18,6,42,1,3,2,0,0
759985267390294_1573386842716795,"Hey everyone... We fixed things so you trolls cant hijack everything again. But for those of you that think you can... good luck ;)
We are live streaming an amazon Alexa that will say what ever you tell it to say on this link: https://speak.ngrok.io
Curious to see what happens!",Waseem Shabout,speak.ngrok.io,link,https://speak.ngrok.io/,2017-04-15 19:09:37,7,4,0,7,0,0,0,0,0
759985267390294_1574061719315974,"Hi all,
Why should we learn GraphQl ?",Abhinav Ravi,,status,,2017-04-16 09:36:14,3,3,0,3,0,0,0,0,0
759985267390294_1574574345931378,,Jay Gupta,Nethemba,link,https://arstechnica.com/security/2017/04/nsa-leaking-shadow-brokers-just-dumped-its-most-damaging-release-yet/,2017-04-16 19:39:47,10,0,0,10,0,0,0,0,0
759985267390294_1571650346223778,what are the favourite useful programming languages which is good to learn,Sai Venkata Srinivasan Saripalli,,status,,2017-04-14 09:55:17,1,9,0,1,0,0,0,0,0
759985267390294_1572398812815598,Highest cup stack ever?,Md Malsi,,photo,https://www.facebook.com/photo.php?fbid=345679569167374&set=gm.1572398812815598&type=3,2017-04-14 23:36:36,369,29,0,317,3,40,9,0,0
759985267390294_1574486385940174,We're live at Hack Days in San Francisco! :) Join us!,Dan Gailey,RadBots,video,https://www.facebook.com/radbotsapp/videos/282923608817428/,2017-04-16 17:44:41,1,0,0,1,0,0,0,0,0
759985267390294_1573197169402429,"Try to beat my record on CodeTrace :D --> Level 5, 2796XP",Rafa Mkrtchyan,Rafayel Mkrtchyan at CodeTrace.io,link,https://codetrace.io/users/MicBrain,2017-04-15 15:11:54,22,12,0,16,4,2,0,0,0
759985267390294_1573059496082863,https://m.facebook.com/story.php?story_fbid=752285524952970&id=112282008953328 Wow!,Ashwin Thiagarajan,Google Developers,video,https://www.facebook.com/967415219957038/videos/1466854780013077/,2017-04-15 12:36:51,57,7,4,45,4,8,0,0,0
759985267390294_1573453752710104,Any good resources to learn WebGL?,Harman Singh,,status,,2017-04-15 20:35:11,7,19,0,7,0,0,0,0,0
759985267390294_1572152356173577,"Excited to share a side project that I've been working on!

pokerchips.io is a mobile-first web app that lets you play poker with your friends when you don't have chips. Simply create a table, share the link with your friends, and start playing poker — using your phones as virtual chip remotes. Check it out!",Raymond Xu,pokerchips.io,link,http://pokerchips.io/,2017-04-14 18:31:13,126,12,1,112,7,7,0,0,0
